Duration,Title,Published_date,Views,Likes,Comments,Type
30.0,Porsche bate em arquibancada,2024-08-28,1488,33,1,Short
60.0,E se um carro quebrar no meio do rali?,2024-08-28,11878,596,3,Short
60.0,Kamala Harris falou mais de Donald Trump do que de si mesma?,2024-08-28,3136,108,1,Short
38.0,Quiz de 200K com Rafael Colombo | Parte 2,2024-08-28,378,22,0,Short
46.0,Quiz de 200K com Rafael Colombo,2024-08-28,516,26,0,Short
6274.0,"RICARDO VENTURA - PORTAS ABERTAS, COM CARLOS TRAMONTINA - #59 #PA",2024-08-28,8221,760,40,Live
4503.0,MARÇAL APARECE EM 1º EM PESQUISA DO INSTITUTO VERITÁ; BOULOS EM 2º - FLOW NEWS - #317 #FN,2024-08-27,25299,1198,45,Live
3720.0,POLÍCIA PRENDE 3 SUSPEITOS POR INCÊNDIOS EM SP; PREJUÍZO PODE CHEGAR A 1BI - FLOW NEWS - #316 #FN,2024-08-26,3611,371,9,Live
60.0,Marçal e Bolsonaro trocam farpas nas redes sociais,2024-08-26,1079,60,2,Short
60.0,Como desenvolver boas políticas públicas?,2024-08-26,1252,61,0,Short
2597.0,KAMALA PREGA A CONVERTIDOS E IGNORA ELEITORADO INDECISO - FLOW NEWS INTERNACIONAL - #20 #FI,2024-08-24,1568,122,3,Short
4072.0,"NUNES TEM 24,1%, BOULOS, 21,9%, E MARÇAL, 17,9%, SEGUNDO PARANÁ PESQUISAS - FLOW NEWS - #315 #FN",2024-08-23,6929,437,15,Live
59.0,A campanha eleitoral em São Paulo foi sequestrada?,2024-08-23,1661,81,10,Short
60.0,Pablo Marçal é uma ameaça para Bolsonaro?,2024-08-23,15632,837,62,Short
59.0,"Sem Boulos, Nunes e Datena, o engajamento de Marçal despenca",2024-08-23,2666,156,8,Short
4752.0,"O PAÍS DO TERRAPLANISMO ECONÔMICO, COM MARCOS LISBOA - TRAMONTA NEWS - #49 #TN",2024-08-23,3429,279,21,Live
4517.0,"PABLO MARÇAL CRESCE E EMPATA COM BOULOS E NUNES NA DISPUTA EM SP, DIZ DATAFOLHA - FLOW NEWS #314 #FN",2024-08-22,26911,1383,114,Live
60.0,A esperança está de volta,2024-08-22,1517,44,4,Short
4096.0,"LUCAS MORAES (PILOTO) - CONEXÕES, COM GLORIA VANIQUE - #57 #CX",2024-08-22,749,70,1,Live
2027.0,"""ESPERANÇOSO"", OBAMA CRITICA TRUMP E RENOVA SLOGAN POR KAMALA - FLOW NEWS INTERNACIONAL - #19 #FI",2024-08-22,1158,121,3,Short
3690.0,PESQUISA ATLAS: BOULOS EM 1º; MARÇAL CRESCE E JÁ AMEAÇA POSIÇÃO DE NUNES - FLOW NEWS - #313 #FN,2024-08-21,17345,843,50,Live
59.0,"Transparência, rastreabilidade e correção",2024-08-21,7242,325,10,Short
59.0,Nova pandemia a caminho?,2024-08-21,2366,132,4,Short
59.0,Pablo Marçal fora das eleições?,2024-08-21,2692,134,10,Short
59.0,A relação do Carmed Fini e o sucesso nas redes da Cimed,2024-08-21,2372,109,1,Short
60.0,Você acredita em astrologia? ✨️👀,2024-08-21,806,55,2,Short
4401.0,"KARLA MARQUES (CIMED) - PORTAS ABERTAS, COM CARLOS TRAMONTINA - #58 #PA",2024-08-21,1574,111,6,Live
3828.0,"BOLSONARO TEME PERDER ELEITORADO, SE AFASTA DE MARÇAL E PEDE VOTO A NUNES - FLOW NEWS - #312 #FN",2024-08-20,9734,621,52,Live
60.0,Como a Loud conseguiu criar a sua comunidade?,2024-08-20,562,26,0,Short
60.0,Como enfrentar adversários como Pablo Marçal?,2024-08-20,2084,83,8,Short
59.0,Um legado chamado Silvio Santos,2024-08-20,2805,133,1,Short
60.0,Ainda há chances de ocorrer um cessar-fogo em Gaza?,2024-08-20,807,32,0,Short
57.0,Como ideologias políticas atrapalham o desenvolvimento da ciência?,2024-08-20,570,36,3,Short
60.0,Novas regras para campanhas eleitorais nas redes: o que esperar?,2024-08-20,749,35,1,Short
4207.0,"BOULOS, NUNES E DATENA DESISTEM DO DEBATE CONTRA MARÇAL; TABATA CRITICA - FLOW NEWS - #311 #FN",2024-08-19,15885,869,45,Live
18.0,Fujões?,2024-08-19,2351,87,1,Short
60.0,Quais os principais sítios arqueológicos do Brasil?,2024-08-19,273,15,0,Short
60.0,Gil Rugai é solto depois de 11 anos e 9 meses preso,2024-08-19,683,29,1,Short
60.0,FAB nega que veículos de imprensa tenham acessado caixa-preta de avião da Voepass,2024-08-19,1920,91,3,Short
20.0,Avião da Voepass faz pouso de emergência em Uberlândia,2024-08-19,13415,374,9,Short
60.0,Novas eleições na Venezuela?,2024-08-19,1586,91,1,Short
58.0,Alexandre de Moraes usou o TSE a seu favor?,2024-08-19,34845,824,32,Short
1869.0,"EUA, CATAR E EGITO NEGOCIAM CESSAR-FOGO EM GAZA PARA BREVE - FLOW NEWS INTERNACIONAL - #18 #FI",2024-08-17,1059,105,6,Short
3689.0,TSE DIVULGA NOVAS REGRAS SOBRE REDES SOCIAIS E IA NAS ELEIÇÕES - FLOW NEWS - #310 #FN,2024-08-16,2593,262,8,Live
60.0,O Flow é só uma conversa de bar?,2024-08-16,958,66,1,Short
59.0,Os candidatos à prefeitura de São Paulo vão ganhar mais espaço nas redes sociais?,2024-08-16,5073,248,16,Short
60.0,Game over ❌,2024-08-16,623,37,1,Short
5765.0,"A IMPORTÂNCIA DO CONHECIMENTO CIENTÍFICO, COM NATÁLIA PASTERNAK - TRAMONTA NEWS - #48 #TN",2024-08-16,1917,167,11,Live
4640.0,LULA NEGA VITÓRIA DE MADURO E PEDE NOVAS ELEIÇÕES - FLOW NEWS - #309 #FN,2024-08-15,3738,342,18,Live
4997.0,"RODRIGO ELIAS (ARQUEOLOGIA PELO MUNDO) - CONEXÕES, COM GLORIA VANIQUE - #56 #CX",2024-08-15,693,59,2,Live
2468.0,"SEM MÉXICO, LULA PROCURA COLÔMBIA PARA MEDIAR CRISE NA VENEZUELA - FLOW NEWS INTERNACIONAL - #17 #FI",2024-08-15,1253,119,2,Short
4787.0,MENSAGENS VAZADAS REVELAM ARTICULAÇÃO DE MORAES CONTRA BOLSONARISTAS NO TSE - FLOW NEWS - #308 #FN,2024-08-14,4966,392,16,Live
56.0,Pablo Marçal pode se tornar o candidato preferido dos bolsonaristas?,2024-08-14,975,48,2,Short
56.0,Você tiraria o seu sotaque?,2024-08-14,1045,42,2,Short
59.0,Rebeca Andrade é ovacionada em voo entre Rio de Janeiro e São Paulo,2024-08-14,628,61,0,Short
60.0,Pablo Marçal só quer cortes para internet?,2024-08-14,1574,64,9,Short
56.0,A cobertura das #Olimpíadas feita pela CazéTV foi boa?,2024-08-14,3880,338,1,Short
60.0,Fora break dance!,2024-08-14,1729,85,1,Short
59.0,Olha o acidente?!,2024-08-14,384,28,1,Short
58.0,O que a Ucrânia espera invadindo a Rússia?,2024-08-14,8503,364,6,Short
60.0,Como você conheceu o comandante Hamilton?,2024-08-14,1456,90,1,Short
60.0,"Para fazer um podcast, é necessário saber tudo sobre o convidado?",2024-08-14,568,55,0,Short
60.0,O que se sabe sobre o avião que caiu em Vinhedo?,2024-08-14,11132,687,4,Short
60.0,Você é a favor da isenção do imposto dos prêmios dos atletas olímpicos?,2024-08-14,3126,135,3,Short
58.0,Como foi a desenvoltura dos candidatos à prefeitura de São Paulo em seu primeiro debate?,2024-08-14,1016,22,5,Short
4439.0,"BRUNO PLAYHARD - PORTAS ABERTAS, COM CARLOS TRAMONTINA - #57 #PA",2024-08-14,1614,204,4,Live
4024.0,PABLO MARÇAL CRESCE COMO ALTERNATIVA À DIREITA E JÁ AMEAÇA NUNES - FLOW NEWS - #307 #FN,2024-08-13,7867,511,63,Live
55.0,Avião cai no interior de São Paulo,2024-08-13,16002,780,8,Short
60.0,O começo de tudo,2024-08-13,828,89,2,Short
3832.0,17 VÍTIMAS DO ACIDENTE AÉREO FORAM IDENTIFICADAS; IML CONTINUA TRABALHANDO - FLOW NEWS - #306 #FN,2024-08-12,4756,387,6,Live
1686.0,RÚSSIA SE PREPARA PARA RETALIAR INVASÃO UCRANIANA - FLOW NEWS INTERNACIONAL - #16 #FI,2024-08-10,13019,541,27,Short
5205.0,AVIÃO COM 61 PESSOAS CAI EM VINHEDO (SP); NÃO HÁ SOBREVIVENTES - FLOW NEWS - #305 #FN,2024-08-09,39993,1430,17,Live
57.0,Nunes x Boulos x Datena x Marçal: Quem chegará ao segundo turno?,2024-08-09,1782,54,9,Short
55.0,Ministério pede desculpa por apagar Rebeca Andrade de foto no pódio das Olimpíadas,2024-08-09,6161,265,1,Short
55.0,Netanyahu está fazendo apenas um jogo político com os conflitos envolvendo Israel?,2024-08-09,1758,81,0,Short
60.0,O primeiro teste de Júlia Konrad,2024-08-09,5544,441,1,Short
3303.0,DESEMPENHO DOS CANDIDATOS À PREFEITURA DE SÃO PAULO NO DEBATE DA BAND - ESPECIAL ELEIÇÕES - #FN,2024-08-09,41883,1350,153,Short
5897.0,"O QUE O FLOW INVENTOU E AGORA QUER REINVENTAR?, COM IGOR 3K - TRAMONTA NEWS - #47 #TN",2024-08-09,23229,1657,61,Live
3801.0,LULA ASSINA MP QUE ISENTA ATLETAS OLÍMPICOS DE PAGAR IMPOSTOS POR PREMIAÇÃO - FLOW NEWS - #304 #FN,2024-08-08,2729,265,1,Live
60.0,Qual é o valor do prêmio dos atletas olímpicos?,2024-08-08,6720,299,2,Short
40.0,"Terremoto de magnitude 7,1 atinge o Japão",2024-08-08,9642,293,2,Short
58.0,Ricardo Nunes faz exame toxicológico para mostrar que não usa cocaína,2024-08-08,5660,111,15,Short
60.0,As escolas doutrinam os alunos?,2024-08-08,961,62,4,Short
58.0,Comandante Hamilton fala o que acha da candidatura de Datena,2024-08-08,4997,255,4,Short
3653.0,"JULIA KONRAD - CONEXÕES, COM GLORIA VANIQUE - #55 #CX",2024-08-08,893,65,1,Live
4117.0,"ATLETAS OLÍMPICOS PAGARÃO IMPOSTOS COMO QUALQUER TRABALHADOR, DIZ RECEITA - FLOW NEWS - #303 #FN",2024-08-07,2042,217,9,Live
2101.0,CRESCE TENSÃO ENTRE IRÃ E ISRAEL - FLOW NEWS INTERNACIONAL - #15 #FI,2024-08-07,2458,158,4,Short
4829.0,"COMANDANTE HAMILTON - PORTAS ABERTAS, COM CARLOS TRAMONTINA - #56 #PA",2024-08-07,3641,272,12,Live
28.0,Não há como controlar a vontade do mar 🌊,2024-08-07,484,42,0,Short
58.0,A recessão vem aí?,2024-08-07,738,42,0,Short
60.0,A meia-entrada deve ser obrigatória?,2024-08-07,2278,118,3,Short
60.0,Rebeca Andrade é histórica! 🥇,2024-08-07,10012,897,11,Short
36.0,Bia Souza e equipe de judô brasileira visitam a Casa Brasil,2024-08-07,815,66,0,Short
60.0,O que você acha sobre o homeschooling?,2024-08-07,622,26,10,Short
60.0,Quais os melhores personagens?,2024-08-07,1090,41,1,Short
60.0,Qual a posição do Brasil em relação à Venezuela?,2024-08-07,7818,366,12,Short
60.0,Mulher é presa por injúrias raciais e por agredir PM,2024-08-07,1582,110,1,Short
60.0,"No VAR do amor, qual o significado da mão na nuca?",2024-08-07,3035,131,5,Short
20.0,O BRASIL É O PAÍS DO JUDÔ 🥇🥈🥉,2024-08-07,2412,137,0,Short
4337.0,"KAMALA ESCOLHE TIM WALZ, DEMOCRATA COM APELO JUNTO A ELEITORADO CONSERVADOR - FLOW NEWS - #302 #FN",2024-08-06,2386,217,6,Live
3681.0,REBECA ANDRADE É OURO E SE TORNA A MAIOR MEDALHISTA OLÍMPICA DO BRASIL - FLOW NEWS - #301 #FN,2024-08-05,2792,277,7,Live
2003.0,ACORDO ENTRE PAÍSES É O MAIOR DESDE A GUERRA FRIA - FLOW NEWS INTERNACIONAL - #14 #FI,2024-08-03,1181,97,3,Short
3958.0,JUDOCA BIA SOUZA VENCE ISRAELENSE E CONQUISTA O 1º OURO DO BRASIL EM PARIS - FLOW NEWS - #300 #FN,2024-08-03,2951,243,5,Live
60.0,A nova geração da ginástica brasileira 🥉,2024-08-02,7162,591,4,Short
59.0,O que você faria se ganhasse uma medalha nas #Olimpíadas?,2024-08-02,3012,183,1,Short
58.0,Maduro desafia Elon Musk para luta,2024-08-02,8386,380,9,Short
55.0,Como a educação pode melhorar o Brasil?,2024-08-02,960,32,0,Short
57.0,A ginástica é bronze!,2024-08-02,790,48,0,Short
52.0,É possivel diminuir a desigualdade no Brasil?,2024-08-02,2464,85,16,Short
60.0,A postura de Lula sobre a Venezuela é adequada?,2024-08-02,1845,59,3,Short
4664.0,"EDUCAÇÃO BÁSICA NO BRASIL, COM PRISCILA CRUZ - TRAMONTA NEWS - #46 #TN",2024-08-02,1708,137,14,Live
60.0,O que pode acontecer na Venezuela?,2024-08-02,3731,220,0,Short
4882.0,MILEI AGRADECE BRASIL POR ASSUMIR EMBAIXADA ARGENTINA NA VENEZUELA - FLOW NEWS - #299 #FN,2024-08-01,5299,367,5,Live
60.0,Os ricos não têm noção da riqueza que possuem?,2024-08-01,1575,78,3,Short
60.0,"Alô, presidente?",2024-08-01,1105,39,1,Short
58.0,PT legitimou vitória de Nicolás Maduro antes de pronunciamento de Lula,2024-08-01,4569,83,6,Short
2024.0,"LULA NÃO VÊ – OU NÃO QUER VER? – ""NADA DE ANORMAL"" NA VENEZUELA - FLOW NEWS INTERNACIONAL - #13 #FI",2024-08-01,2083,163,5,Short
3920.0,ORGANIZAÇÃO INTERNACIONAL GARANTE: ELEIÇÃO VENEZUELANA NÃO FOI DEMOCRÁTICA - FLOW NEWS - #298 #FN,2024-07-31,3633,329,5,Live
60.0,Como o teatro se sustenta?,2024-07-31,1174,70,3,Short
59.0,Lula se manifesta sobre eleição na Venezuela,2024-07-31,278254,12467,279,Short
60.0,Motorista de Porsche persegue e mata motociclista na zona sul de SP,2024-07-31,586,20,2,Short
57.0,Como a polarização interfere na política?,2024-07-31,586,17,3,Short
60.0,Eleição na Venezuela: Qual o posicionamento do Governo Lula?,2024-07-31,5450,192,2,Short
60.0,Até onde pode chegar Rayssa Leal?,2024-07-31,472,30,0,Short
60.0,O que esperar da corrida eleitoral à presidência dos Estados Unidos?,2024-07-31,3580,87,0,Short
58.0,Para quem o presidente Lula deve direcionar o seu discurso?,2024-07-31,1301,28,6,Short
5207.0,"ODILON WAGNER - PORTAS ABERTAS, COM CARLOS TRAMONTINA - #55 #PA",2024-07-31,1609,180,9,Live
4216.0,LULA E BIDEN CONVERSAM SOBRE ELEIÇÃO E CRISE DIPLOMÁTICA NA VENEZUELA - FLOW NEWS - #297 #FN,2024-07-30,6224,436,5,Live
33.0,Motorista de Porsche amarelo atropela e mata motociclista em SP,2024-07-30,978,24,1,Short
60.0,Remédio injetável aplicado duas vezes por ano mostra eficácia na prevenção do HIV,2024-07-30,932,56,0,Short
3587.0,MADURO DECLARA VITÓRIA SEM COMPROVAR DADOS; OPOSIÇÃO CONTESTA RESULTADO - FLOW NEWS - #296 #FN,2024-07-29,4089,376,6,Short
59.0,Haddad é o melhor ministro do Governo Lula?,2024-07-29,1793,46,25,Short
60.0,Matheus Ceará não voltaria para a Praça?,2024-07-29,9929,386,1,Short
3698.0,"PELA 1ª VEZ FORA DE UM ESTÁDIO, PARIS CELEBRA A ABERTURA DAS OLIMPÍADAS - FLOW NEWS - #295 #FN",2024-07-27,2991,211,13,Live
2662.0,OPOSIÇÃO CRESCE NA VENEZUELA E DESAFIA O CHAVISMO - FLOW NEWS INTERNACIONAL - #12 #FI,2024-07-27,2031,163,5,Short
60.0,Aceita uma carona?,2024-07-26,810,67,2,Short
60.0,Os mais ricos devem pagar mais impostos?,2024-07-26,9974,373,43,Short
5861.0,"OS RUMOS DA ECONOMIA E DA POLÍTICA, COM ANDRÉ RONCAGLIA - TRAMONTA NEWS - #45 #TN",2024-07-26,101699,7064,623,Live
3590.0,NOVO REMÉDIO TEM EFICÁCIA COMPROVADA PARA PREVENIR O VÍRUS HIV - FLOW NEWS - #294 #FN,2024-07-25,2352,240,10,Short
48.0,Quais as chances das equipes de vôlei brasileiras conquistarem medalhas em #Paris2024?,2024-07-25,792,32,0,Short
59.0,O uniforme da delegação brasileira para os #JogosOlímpicos representa o Brasil?,2024-07-25,2880,154,3,Short
59.0,Discurso de Kamala Harris é marcado por ataques a Trump,2024-07-25,4706,163,4,Short
2525.0,"EM 1º DISCURSO, KAMALA CRITICA TRUMP E GARANTE: ""VAMOS VENCER"" - FLOW NEWS INTERNACIONAL - #11 #FI",2024-07-25,1816,160,5,Short
3816.0,PRESIDENTE DA VENEZUELA CRITICA SISTEMA ELEITORAL BRASILEIRO - FLOW NEWS - #293 #FN,2024-07-24,3078,278,8,Live
58.0,A amizade é tudo ✨,2024-07-24,14201,950,9,Short
57.0,Privatização da Sabesp: Qual a sua opinião?,2024-07-24,2778,116,21,Short
59.0,"Foi mal, tava doidão! 🦈",2024-07-24,2901,144,7,Short
47.0,Você já atualizou seu repertório de piadas hoje? 👀,2024-07-24,4997,180,3,Short
6449.0,"MATHEUS CEARÁ - PORTAS ABERTAS, COM CARLOS TRAMONTINA - #54 #PA",2024-07-24,6632,507,11,Live
4678.0,PESQUISA APONTA EMPATE ENTRE KAMALA E TRUMP; DEMOCRATA TEM LIGEIRA VANTAGEM - FLOW NEWS - #292 #FN,2024-07-23,3078,311,11,Live
56.0,Balão cai na zona leste de São Paulo,2024-07-23,2176,86,1,Short
59.0,"Qual é o segredo do sucesso de ""A Praça É Nossa""?",2024-07-23,4350,246,3,Short
58.0,"""Homem-aranha"" e ""Batman"" brigam no metrô de BH",2024-07-23,1065,42,1,Short
52.0,O Brasil vai superar o resultado dos jogos de Tóquio em #Paris2024?,2024-07-23,436,13,0,Short
60.0,Kamala Harris conseguirá vencer Donald Trump?,2024-07-23,1885,64,4,Short
4083.0,BIDEN NÃO SUPORTA PRESSÃO E DESISTE; KAMALA HARRIS É A FAVORITA - FLOW NEWS - #291 #FN,2024-07-22,3364,314,2,Live
57.0,O Brasil é refém de governos populistas?,2024-07-22,1144,62,4,Short
58.0,Falta transparência no Governo Lula?,2024-07-22,3687,182,2,Short
59.0,Até que ponto a aparência exterior reflete nosso estado interior?,2024-07-22,1241,56,1,Short
60.0,Carlos Alberto não fala com Silvio Santos há anos?,2024-07-22,90651,3843,24,Short
2826.0,TRUMP AFIA O DISCURSO E PROMETE UNIÃO - DIVIDINDO - FLOW NEWS INTERNACIONAL - #10 #FI,2024-07-20,1555,118,6,Short
60.0,Nosso corpo é apenas nosso,2024-07-19,6491,209,5,Short
60.0,TSE vai enviar observadores para eleições na Venezuela,2024-07-19,19413,1273,34,Short
58.0,Disney vai entrar em greve? 🏰,2024-07-19,651,42,1,Short
4530.0,"APAGÃO NA MICROSOFT GERA INSTABILIDADE E AFETA VOOS, BANCOS E HOSPITAIS - FLOW NEWS - #290 #FN",2024-07-19,3635,304,10,Live
58.0,A lealdade a políticos passou dos limites?,2024-07-19,1203,57,1,Short
57.0,Lula deveria medir melhor suas palavras?,2024-07-19,8749,384,6,Short
59.0,Fifa investiga vídeo de jogadores argentinos cantando músicas racistas,2024-07-19,10722,727,36,Short
4466.0,"POLÍTICA, DEMOCRACIA E JORNALISMO, COM FELIPE MOURA BRASIL - TRAMONTA NEWS - #44 #TN",2024-07-19,13952,1551,158,Live
4845.0,"NA CONVENÇÃO DOS REPUBLICANOS, TRUMP FARÁ 1º DISCURSO PÓS-ATENTADO - FLOW NEWS - #289 #FN",2024-07-18,3778,305,4,Live
58.0,Está mais difícil fazer humor hoje?,2024-07-18,925,54,5,Short
60.0,O Irã quer assassinar Donald Trump?,2024-07-18,3484,178,1,Short
3851.0,"ALEXANDRA GURGEL - CONEXÕES, COM GLORIA VANIQUE - #54 #CX",2024-07-18,934,64,5,Live
2232.0,TRUMP ESCOLHE VICE; PESQUISA APONTA EMPATE COM BIDEN – FLOW NEWS INTERNACIONAL #09 #FI,2024-07-18,1183,121,5,Short
4200.0,"APÓS ATENTADO, PESQUISA APONTA EMPATE ENTRE TRUMP E BIDEN – FLOW NEWS - #288 #FN",2024-07-17,3028,256,5,Live
60.0,Taxxad: Haddad vira meme nas redes,2024-07-17,11079,618,32,Short
59.0,Carlos Alberto errou ao falar de Lula,2024-07-17,19940,659,48,Short
60.0,A Praça é Nossa?,2024-07-17,2830,136,1,Short
5264.0,"CARLOS ALBERTO DE NÓBREGA - PORTAS ABERTAS, COM CARLOS TRAMONTINA - #53 #PA",2024-07-17,22702,1444,66,Live
4146.0,PT NEGA INCÔMODO COM MEMES SOBRE AUMENTO DE IMPOSTOS NA GESTÃO HADDAD - FLOW NEWS - #287 #FN,2024-07-16,3354,276,7,Live
56.0,O problema de Cuba é o comunismo?,2024-07-16,1707,65,16,Short
58.0,Nego Di é preso por estelionato,2024-07-16,3874,170,4,Short
60.0,Cachorro ataca porteiros e moradores de condomínio na Bahia,2024-07-16,945,41,1,Short
4274.0,ATENTADO CONTRA TRUMP DESARRUMA TABULEIRO DEMOCRATA - #286 #FN,2024-07-15,4948,458,10,Live
58.0,"Abin paralela: Ex-diretor da Abin, Ramagem nega espionagem de autoridades",2024-07-15,3738,126,4,Short
60.0,Ele compôs músicas para Marília Mendonça aos 11 anos!,2024-07-15,2485,109,0,Short
58.0,Jogo do Tigrinho liberado?,2024-07-15,1605,43,2,Short
58.0,Biden confunde nome de Zelensky com Putin e Kamala Harris com Trump,2024-07-15,13173,534,7,Short
60.0,Trump sofre atentado durante discurso na Pensilvânia,2024-07-15,872,13,1,Short
58.0,O capitalismo está em crise?,2024-07-13,1075,53,2,Short
2008.0,"BIDEN INSISTE NA CANDIDATURA, MAS PRESSÃO ENTRE DEMOCRATAS AUMENTA – FLOW NEWS INTERNACIONAL #08 #FI",2024-07-13,1497,140,4,Short
4190.0,"GOVERNO ESTUDA REGULAMENTAR FORTUNE TIGER, O “JOGO DO TIGRINHO” – FLOW NEWS - #285 #FN",2024-07-12,2112,232,9,Live
55.0,A ligação entre Hugo Henrique e Cristiano Araújo,2024-07-12,3118,234,0,Short
60.0,Policial dispara contra goleiro do Grêmio Anápolis,2024-07-12,1139,53,0,Short
59.0,Yuri Lima se pronuncia após traição a Iza,2024-07-12,9382,305,6,Short
4186.0,GOLEIRO LEVA TIRO DE POLICIAL APÓS JOGO EM GOIÁS; PM APURA – FLOW NEWS - #284 #FN,2024-07-11,2084,227,4,Live
56.0,Caso das joias: PF rebate contradições de Bolsonaro,2024-07-11,2985,96,6,Short
54.0,"""O início de duas lenda""",2024-07-11,10668,1125,7,Short
10.0,Goleiro é baleado na perna por PM,2024-07-11,772,21,5,Short
59.0,Governo brasileiro condena bombardeio contra hospital pediátrico na Ucrânia,2024-07-11,705,36,0,Short
54.0,Você se lembra do Huguinho do Raul Gil?,2024-07-11,761,29,0,Short
4498.0,"HUGO HENRIQUE - CONEXÕES, COM GLORIA VANIQUE - #53 #CX",2024-07-11,936,72,13,Live
2303.0,BIDEN RECEBE LÍDERES DA OTAN PARA CÚPULA EM WASHINGTON - FLOW NEWS INTERNACIONAL - #07 #FI,2024-07-11,873,101,4,Short
4846.0,QUAEST: 54% APROVAM LULA; 39% DOS EVANGÉLICOS REJEITAM – FLOW NEWS - #283 #FN,2024-07-10,2284,236,10,Live
60.0,Brasil fora da Copa América,2024-07-10,13729,662,24,Short
54.0,A direita sabe usar melhor as redes sociais?,2024-07-10,1400,36,3,Short
57.0,Bolsonaro quer reverter inelegibilidade,2024-07-10,836,33,2,Short
59.0,O Brasil pode virar comunista?,2024-07-09,1065,40,11,Short
54.0,Ele foi expulso de Cuba!,2024-07-09,649,28,1,Short
60.0,Quem pode substituir Biden?,2024-07-09,935,24,0,Short
4223.0,EVENTO DA DIREITA EM SC REAFIRMA BOLSONARO CANDIDATO E CONFRONTA JUDICIÁRIO - #282 #FN,2024-07-08,2758,270,8,Live
58.0,"Idosa é enganada por ""Arnold Schwarzenegger""",2024-07-08,13005,623,11,Short
58.0,PMs apontam armas para adolescentes negros filhos de diplomatas,2024-07-08,10765,436,39,Short
60.0,Cuidado: Radioativo ⚠️,2024-07-08,848,68,0,Short
52.0,Dupla ameaça divulgar fotos do ex-piloto Michael Schumacher,2024-07-07,18349,610,10,Short
2554.0,DEMOCRATAS QUEREM KAMALA HARRIS NO LUGAR DE JOE BIDEN - FLOW NEWS INTERNACIONAL - #06 #FI,2024-07-06,2610,201,8,Short
58.0,Bolsonaro é indiciado em inquérito das joias,2024-07-06,3970,127,9,Short
58.0,Reputação ou consciência: o que vale mais pra você?,2024-07-06,619,44,1,Short
4576.0,MATERIAL RADIOATIVO É FURTADO EM SP; GOVERNO FEDERAL EMITE ALERTA - FLOW NEWS - #281 #FN,2024-07-05,2088,215,13,Live
53.0,Lula é comunista?,2024-07-05,3459,96,25,Short
54.0,Caso Joca: laudo revela causa da morte golden,2024-07-05,15263,1209,28,Short
5156.0,"O COMUNISMO NO SÉCULO XXI, COM GUSTAVO GAIOFATO - TRAMONTA NEWS - #43 #TN",2024-07-05,62845,5986,484,Live
4431.0,ACUSADOS AMEAÇAVAM EXPOR FOTOS DE SCHUMACHER EM TROCA DE MILHÕES DE EUROS - FLOW NEWS - #280 #FN,2024-07-04,3074,262,8,Live
60.0,O que você faria se encontrasse um objeto perdido?,2024-07-04,623,31,0,Short
46.0,Fim dos leilões de arroz,2024-07-04,478,30,3,Short
55.0,Casa de férias da realeza britânica poderá ser alugada,2024-07-04,4061,188,3,Short
51.0,Eleições no Reino Unido já tem um vencedor definido?,2024-07-04,323,10,0,Short
4993.0,"MARCOS CAVALLARIA - CONEXÕES, COM GLORIA VANIQUE - #52 #CX",2024-07-04,610,51,5,Live
2058.0,UK: ELEIÇÕES DEVEM ENCERRAR 14 ANOS DE GOVERNO CONSERVADOR - FLOW NEWS INTERNACIONAL - #05 #FI,2024-07-04,920,108,0,Short
3905.0,HADDAD SE REÚNE COM LULA PARA ALINHAR DISCURSO E TRANQUILIZAR MERCADO - FLOW NEWS - #279 #FN,2024-07-03,2902,279,4,Live
54.0,Milei está insultando o Brasil?,2024-07-03,7376,410,65,Short
58.0,"Lula, Campos Neto e a alta do dólar",2024-07-03,9002,293,16,Short
59.0,A saída de Manoel Soares da Globo,2024-07-03,1243,87,2,Short
4466.0,"MANOEL SOARES - PORTAS ABERTAS, COM CARLOS TRAMONTINA - #52 #PA",2024-07-03,2686,212,7,Live
58.0,A extrema-direita vai vencer na França?,2024-07-02,4849,167,15,Short
56.0,Gilberto Gil anuncia aposentadoria,2024-07-02,459,25,6,Short
3850.0,"DÓLAR DISPARA DEPOIS DE FALAS DE LULA SOBRE ""ATAQUE ESPECULATIVO"" - FLOW NEWS - #278 #FN",2024-07-02,3489,339,30,Live
57.0,Lula com os cantores sertanejos?,2024-07-02,9126,453,28,Short
54.0,Quanto vale um cancelamento?,2024-07-02,12785,344,2,Short
60.0,Fim das corridas de cavalo em SP?,2024-07-02,261,21,1,Short
60.0,Multa por doar comida?,2024-07-02,361,30,2,Short
3915.0,KAJURU QUER APROXIMAR LULA A CANTORES SERTANEJOS IDENTIFICADOS COM BOLSONARO - FLOW NEWS - #277 #FN,2024-07-01,3102,242,5,Live
59.0,Trump x Biden: Quem se saiu melhor no debate?,2024-07-01,1139,38,1,Short
57.0,Como cativar o público?,2024-07-01,390,16,0,Short
59.0,A intuição de Rafael Colombo,2024-06-29,478,33,1,Short
2256.0,"SOB AS BENÇÃOS DE LE PEN, JORDAN BARDELLA CRESCE NA FRANÇA - FLOW NEWS INTERNACIONAL - #04 #FI",2024-06-29,1568,130,8,Short
4296.0,RUBINHO NUNES RECUA DE PL QUE PREVÊ MULTA POR DOAÇÃO DE COMIDA EM SP - FLOW NEWS - #276 #FN,2024-06-28,2621,228,26,Live
60.0,"Prefeitura de SP: Nunes, Boulos e Datena estão tecnicamente empatados",2024-06-28,2152,82,5,Short
59.0,Lula faz o dólar subir?,2024-06-28,3796,91,1,Short
60.0,Foi de Americanas,2024-06-28,2005,112,1,Short
60.0,Eliana na Globo!,2024-06-28,1671,111,10,Short
4116.0,"REALITY SHOWS E CULTURA DE (SUB?)CELEBRIDADES, COM CHICO BARNEY - TRAMONTA NEWS - #42 #TN",2024-06-28,2124,199,8,Live
4725.0,"PF PROCURA EX-DIRETORES DAS AMERICANAS; FRAUDE PODE CHEGAR A R$ 25,3 BILHÕES - FLOW NEWS - #275 #FN",2024-06-27,3272,301,5,Live
59.0,Por que Biden não preparou um sucessor?,2024-06-27,18790,796,9,Short
60.0,40 gramas: essa é a quantidade permitida para o porte de maconha para uso pessoal,2024-06-27,5399,250,22,Short
57.0,Bolívia sofre tentativa de golpe de Estado,2024-06-27,6021,293,20,Short
3515.0,BIDEN E TRUMP VOLTAM A SE ENFRENTAR EM DEBATE; CLIMA É DE GUERRA - FLOW NEWS INTERNACIONAL - #03 #FI,2024-06-27,1876,186,14,Short
4165.0,40 GRAMAS: STF DESCRIMINALIZA PORTE DE MACONHA PARA USO PESSOAL - FLOW NEWS - #274 #FN,2024-06-26,2388,270,14,Live
57.0,Pablo Marçal vai para o segundo turno?,2024-06-26,5549,214,14,Short
55.0,Youtuber americano participa de perseguição dentro de viatura da PM de SP,2024-06-26,12115,372,30,Short
60.0,Porte de maconha descriminalizado,2024-06-26,416,37,0,Short
56.0,Imitador nato,2024-06-26,2478,79,1,Short
5811.0,"BELUTTI - PORTAS ABERTAS, COM CARLOS TRAMONTINA - #51 #PA",2024-06-26,1682,161,7,Live
4171.0,YOUTUBER AMERICANO PARTICIPA DE AÇÃO DA PM DE SP; SSP APURA O CASO - FLOW NEWS - #273 #FN,2024-06-25,3153,272,12,Live
60.0,O que você acha do vice de Ricardo Nunes?,2024-06-25,6492,257,5,Short
59.0,Pantanal em chamas,2024-06-25,438,29,2,Short
59.0,Policiais na sala de aula?,2024-06-25,773,36,3,Short
60.0,Violência contra transexuais,2024-06-25,1153,53,0,Short
54.0,A maioria dos católicos e evangélicos são contra PL do aborto,2024-06-25,1450,63,3,Short
3905.0,CUCA PEDE DEMISSÃO; FERNANDO DINIZ É DEMITIDO - FLOW NEWS - #272 #FN,2024-06-24,3226,291,4,Live
57.0,Suzana Pires fez terapia para sair da Globo!,2024-06-24,11977,620,1,Short
60.0,Traficante ou usuário?,2024-06-24,757,51,4,Short
59.0,China e EUA retomam negociações sobre uso de armas nucleares após 5 anos,2024-06-24,832,41,1,Short
59.0,Moraes pede 17 anos de prisão para homem que quebrou relógio em 8/1,2024-06-24,108734,3738,375,Short
2580.0,CHINESES E FILIPINOS TROCAM ACUSAÇÕES APÓS CONFRONTO - FLOW NEWS INTERNACIONAL - #02 #FI,2024-06-22,1615,167,8,Short
