Duration,Title,Published_date,Views,Likes,Comments,Type
1116.0,JAVIER MILEITO I DEU PT NA LIBERDADE DE IMPRENSA? - BIGORNA DA REALIDADE - #21 #BR,2023-11-25,3217,425,34,Short
2173.0,LUDMILLA ACUSA THIAGO GAGLIASSO DE CHAMÁ-LA DE MACACA - TRENDING TOPICS - #132 #TT,2023-11-25,3214,102,13,Short
5021.0,MILEI QUER ACABAR COM O MERCOSUL? | APROVADA PEC QUE LIMITA PODERES DO STF - TRAMONTA NEWS - #20 #TN,2023-11-24,2019,165,5,Live
2361.0,RELAÇÃO DE SOGRO E GENRO ACABA EM CARRO QUEIMADO E POLÍCIA - TRENDING TOPICS - #131 #TT,2023-11-24,5853,142,7,Short
4071.0,CESSAR-FOGO ENTRE ISRAEL E HAMAS COMEÇA NESTA SEXTA; REFÉNS SERÃO LIBERTADOS - FLOW NEWS - #137 #FN,2023-11-23,2131,241,5,Live
6430.0,"OLIVIER ANQUIER E ADRIANA ALVES - CONEXÕES, COM GLORIA VANIQUE - #24 #CX",2023-11-23,4584,266,13,Live
2372.0,"BRIGA, RACISMO, PRISÕES E ATRASO EM BRASIL 0 X 1 ARGENTINA - TRENDING TOPICS - #130 #TT",2023-11-23,741,89,3,Short
3742.0,"APÓS BRIGA ENTRE TORCEDORES NO MARACANÃ, BRASIL E ARGENTINA PODEM SER PUNIDOS? - FLOW NEWS #136 #FN",2023-11-22,1555,157,13,Live
4569.0,"WENDEL BEZERRA - PORTAS ABERTAS, COM CARLOS TRAMONTINA - #26 #PA",2023-11-22,2625,397,10,Live
2272.0,BRASIL REGISTRA MAIOR TEMPERATURA DA HISTÓRIA - TRENDING TOPICS - #129 #TT,2023-11-22,653,97,2,Short
4007.0,FIM DA GUERRA? LÍDER DO HAMAS DIZ QUE ACORDO DE TRÉGUA COM ISRAEL ESTÁ PRÓXIMO - FLOW NEWS #135 #FN,2023-11-21,2574,262,12,Live
60.0,UM ANARCO CAPITALISTA DECLARADO ACABOU DE SE TORNAR PRESIDENTE DA REPÚBLICA!,2023-11-21,1342,52,8,Short
60.0,MILEI É UM REFLEXO DOS NOSSOS TEMPOS!,2023-11-21,410,23,1,Short
46.0,KIM KATAGUIRI X SEUS CONCORRENTES,2023-11-21,8930,388,29,Short
2220.0,TAYLOR SWIFT: FÃS MORREM NO RJ | ONDA DE CALOR E VIOLÊNCIA  - TRENDING TOPICS - #128 #TT,2023-11-21,815,90,1,Short
4878.0,"KIM KATAGUIRI, PRÉ-CANDIDATO À PREFEITURA DE SÃO PAULO - FORA DA BOLHA - #24 #FB",2023-11-21,69540,8342,452,Live
3784.0,"APÓS VITÓRIA DE JAVIER MILEI, COMO FICA A RELAÇÃO DO BRASIL COM A ARGENTINA? - FLOW NEWS - #134 #FN",2023-11-20,3476,300,4,Live
3228.0,"TABATA AMARAL, PRÉ-CANDIDATA À PREFEITURA DE SÃO PAULO - FLOW NEWS - #133 #FN",2023-11-18,7813,512,99,Short
2415.0,BRASILEIROS RESGATADOS DE GAZA SÃO AMEAÇADOS NO BRASIL - TRENDING TOPICS - #127 #TT,2023-11-18,1052,101,7,Short
4712.0,AS EXPECTATIVAS PARA O JOGO ENTRE BRASIL E COLÔMBIA NESTA QUINTA-FEIRA - TRAMONTA NEWS - #19 #TN,2023-11-17,1108,127,3,Live
4183.0,CORPO DE MENINO QUE MORREU APÓS SER ESQUECIDO EM VAN ESCOLAR É VELADO EM SP - FLOW NEWS - #132 #FN,2023-11-16,4822,302,18,Live
60.0,QUANDO A COMUNICAÇÃO VIRA ACHISMO!,2023-11-16,949,57,0,Short
60.0,A PRIMEIRA VEZ QUE FALEI DE RACISMO PUBLICAMENTE FOI NA MINHA IGREJA!,2023-11-16,904,62,1,Short
60.0,"A MESMA XENOFOBIA DA ITÁLIA, SOFRI NO BRASIL!",2023-11-16,1229,69,1,Short
60.0,SEMPRE HOUVE POLARIZAÇÃO NO BRASIL!,2023-11-16,1154,50,2,Short
2424.0,"""DAMA DO TRÁFICO"" FAZ VISITA POLÊMICA AO MINISTÉRIO DE DINO - TRENDING TOPICS - #125 #TT",2023-11-15,1612,117,5,Short
3755.0,LULA DIZ QUE ARGENTINA PRECISA DE UM PRESIDENTE QUE “GOSTE DE DEMOCRACIA” - FLOW NEWS - #131 #FN,2023-11-14,2651,227,17,Live
5741.0,"CLEBER MACHADO - PORTAS ABERTAS, COM CARLOS TRAMONTINA - #25 #PA",2023-11-14,10527,1050,25,Live
46.0,CONVERSANDO COM O J.J. ABRAMS SEM SABER!,2023-11-14,1152,44,2,Short
2738.0,ANA HICKMANN TEM BRAÇO IMOBILIZADO APÓS AGRESSÃO DO MARIDO - TRENDING TOPICS - #124 #TT,2023-11-14,3798,157,4,Short
4307.0,PAULO MATHIAS - FORA DA BOLHA - #23 #FB,2023-11-14,8939,923,80,Live
3751.0,ALEXANDRE CORREA ADMITE QUE MENTIU SOBRE AGRESSÃO CONTRA ANA HICKMANN - FLOW NEWS - #130 #FN,2023-11-13,5466,305,3,Live
183.0,LEÃO FOGE DE CIRCO E CIRCULA POR RUAS DE CIDADE #TT,2023-11-13,512,38,0,Short
268.0,MAIORES CIDADES DO BRASIL REGISTRAM CALOR RECORDE #TT,2023-11-13,256,22,0,Short
572.0,ANA HICKMANN ACUSA MARIDO DE AGRESSÃO  #TT,2023-11-13,537,60,0,Short
858.0,ANTÔNIO FAGUNDES VIRALIZA COM VÍDEO DE PREVENÇÃO DE CÂNCER DE PRÓSTATA #FN,2023-11-11,1675,45,2,Short
432.0,QUAL O LIMITE DA INTELIGÊNCIA ARTIFICIAL NAS ARTES?  #FN,2023-11-11,532,32,1,Short
416.0,QUEM SÃO OS INDICADOS AO GRAMMY 2024?  #FN,2023-11-11,556,32,2,Short
2393.0,BRASILEIROS SÃO AUTORIZADOS A SAIR DA FAIXA DE GAZA - TRENDING TOPICS - #123 #TT,2023-11-11,774,94,0,Short
57.0,A SOLIDÃO DA MULHER PRETA SE DESENHA COM MUITAS CAMADAS,2023-11-10,1729,84,19,Short
4130.0,"BRASILEIROS SÃO AUTORIZADOS A DEIXAR GAZA, MAS FRONTEIRA É FECHADA - FLOW NEWS - #129 #FN",2023-11-10,2667,222,12,Live
52.0,COMO É SER CORRESPONDENTE INTERNACIONAL?,2023-11-10,397,20,0,Short
50.0,O HOMEM MAIS SEXY DO MUNDO!,2023-11-10,1224,48,1,Short
166.0,SHOW DO RBD É MARCADO POR ARRASTÕES #TT,2023-11-10,171,7,1,Short
157.0,DEPUTADO DIZ QUE IRÁ PUNIR FILHA CASO VÁ BEM NO ENEM #TT,2023-11-10,231,20,1,Short
394.0,BRASILEIROS SÃO LIBERADOS DA FAIXA DE GAZA #TT,2023-11-10,207,22,3,Short
1005.0,NUDEZ ARTÍSTICA! - BIGORNA DA REALIDADE - #20 #BR,2023-11-10,898,162,7,Short
4198.0,SP: MOTORISTA E PASSAGEIROS DE ÔNIBUS SALVAM MULHER DE TENTATIVA DE ESTUPRO - FLOW NEWS - #128 #FN,2023-11-10,1989,195,9,Live
5494.0,EMBAIXADOR DE ISRAEL DIZ NÃO SABER POR QUE BRASILEIROS ESTÃO FORA DA LISTA - TRAMONTA NEWS - #18 #TN,2023-11-10,1006,117,5,Live
2375.0,"HEZBOLLAH NO BRASIL? PF, ISRAEL E FLÁVIO DINO SE MANIFESTAM - TRENDING TOPICS - #122 #TT",2023-11-10,968,110,0,Short
480.0,PREFEITO RICARDO NUNES SUGERE “CONTRIBUIÇÃO” PARA ENTERRAR FIOS  #FN,2023-11-10,428,25,4,Short
658.0,A POPULARIDADE DO LULA NAS PERIFERIAS #FN,2023-11-10,2396,122,23,Short
506.0,COMO É VIVER EM UM PAÍS EUROPEU PARA BRASILEIROS? #TN,2023-11-10,1286,84,8,Short
412.0,MASSA OU MILEI: QUEM VAI GANHAR AS ELEIÇÕES? #TN,2023-11-10,719,39,8,Short
574.0,EXISTE SOLUÇÃO PARA OS CONFLITOS NA PALESTINA E ISRAEL? #TN,2023-11-10,349,23,1,Short
196.0,TORCIDA DO BOTAFOGO PROTESTAM EM FRENTE AO CT #TT,2023-11-09,82,3,0,Short
183.0,GOVERNO COMEMORA REFORMA TRIBUTÁRIA #TT,2023-11-09,93,5,1,Short
431.0,ATENTADO TERRORIST4 NO BRASIL #TT,2023-11-09,134,9,0,Short
287.0,A PROIBIÇÃO DE CRIANÇAS EM PARADAS LGBT+ #FN,2023-11-09,173,10,0,Short
241.0,O CUSTO DE VIDA EM PORTUGAL #FN,2023-11-09,359,18,6,Short
528.0,"ENEL OU PREFEITURA, QUEM SÃO OS RESPONSÁVEIS PELA FALTA DE ENERGIA? #FN",2023-11-09,229,15,0,Short
4891.0,"VIAJAR COM MILHAS: RAFAELA MOLÁS E TÚLIO FARIA - CONEXÕES, COM GLORIA VANIQUE - #23 #CX",2023-11-09,620,48,14,Live
305.0,COMO SE HOSPEDAR USANDO PONTOS E MILHAS? #CX,2023-11-09,79,4,0,Short
60.0,TODA FAMÍLIA PRECISA DE UM MILHEIRO #CX,2023-11-09,797,37,1,Short
208.0,TOCA UMA SIRENE NO HOTEL PRA NINGUÉM PERDER! #CX,2023-11-09,128,21,1,Short
206.0,NEM SEMPRE O CARTÃO DE CRÉDITO É O MELHOR JEITO PRA ACUMULAR MILHAS! #CX,2023-11-09,153,12,0,Short
3783.0,CRISE DE ENERGIA: PREFEITURA DE SÃO PAULO ANUNCIA AÇÃO CIVIL CONTRA ENEL - FLOW NEWS - #127 #FN,2023-11-09,1474,178,4,Live
2169.0,"COM CALOR RECORDE, EL NIÑO SEGUIRÁ ATÉ ABRIL DE 2024 - TRENDING TOPICS - #121 #TT",2023-11-09,648,86,1,Short
568.0,A DIFERENÇA DAS ELEIÇÕES NOS ESTADOS UNIDOS E BRASIL #PA,2023-11-08,570,46,0,Short
604.0,COMO FUNCIONA A POLARIZAÇÃO EM NOSSA MENTE #PA,2023-11-08,121,8,1,Short
569.0,O BRASILEIRO É O POVO MAIS POLARIZADO? #PA,2023-11-08,116,7,0,Short
404.0,ÁLVARO MACHADO DIAS EXPLICA SOBRE O SENTIMENTO DA NEGATIVIDADE #PA,2023-11-08,97,6,0,Short
210.0,MORADORES PROTESTAM CONTRA ENEL #TT,2023-11-08,72,5,0,Short
176.0,COMISSÃO DO SENADO APROVA REFORMA TRIBUTÁRIA #TT,2023-11-08,87,4,0,Short
212.0,INFLUENCER MORRE APÓS LIPOASPIRAÇÃO NO JOELHO  #TT,2023-11-08,610,26,0,Short
43.0,NEM TODA POLARIZAÇÃO É FAKE NEWS!,2023-11-08,687,24,2,Short
54.0,"PRO TERRORISTA, JUDEU NÃO É GENTE!",2023-11-08,3238,133,1,Short
3753.0,SP: 200 MIL IMÓVEIS SEGUEM SEM ENERGIA; PRAZO DA ENEL TERMINA HOJE - FLOW NEWS - #126 #FN,2023-11-08,2319,268,8,Live
5776.0,"ALVARO MACHADO DIAS - PORTAS ABERTAS, COM CARLOS TRAMONTINA - #24 #PA",2023-11-08,2417,242,6,Live
2460.0,SÃO PAULO VIVE SUPER APAGÃO QUE JÁ DURA 4 DIAS APÓS CHUVAS - TRENDING TOPICS - #120 #TT,2023-11-08,731,92,2,Short
280.0,JORNALISTA CONTA MOMENTO EM QUE ENTREVISTOU UM TERR0RIST4 #FN,2023-11-08,790,59,5,Short
439.0,VOCÊ É A FAVOR OU CONTRA AS PRIVATIZAÇÕES? #FN,2023-11-08,1037,102,17,Short
696.0,OS PREJUÍZOS CAUSADOS PELA FALTA DE ENERGIA EM SÃO PAULO #FN,2023-11-08,767,76,5,Short
60.0,A RESPONSABILIDADE DO APAGÃO EM SÃO PAULO,2023-11-07,562,22,0,Short
125.0,JOVEM É BALEADO EM ABORDAGEM POLICIAL EM COMUNIDADE  #TT,2023-11-07,108,7,0,Short
180.0,AS QUESTÕES ACUSADAS DE CUNHO IDEOLÓGICO NO ENEM #TT,2023-11-07,149,12,1,Short
468.0,APAGÃO DEIXA MILHARES DE PAULISTANOS SEM LUZ POR 4 DIAS #TT,2023-11-07,87,6,0,Short
48.0,VIREI CELEBRIDADE NA CHINA,2023-11-07,4385,185,1,Short
357.0,"A CHINA É CHEIA DE BILIONÁRIOS - E PARA MIM, NÃO HÁ CONTRADIÇÃO NISSO! #FB",2023-11-07,1007,44,29,Short
403.0,O PEQUENO BURGUÊS É CLASSE TRABALHADORA,2023-11-07,1872,98,64,Short
205.0,O PROLETÁRIO VIVE DA VENDA DA SUA FORÇA DE TRABALHO #FB,2023-11-07,645,48,7,Short
4206.0,HUMBERTO MATOS - FORA DA BOLHA - #22 #FB,2023-11-07,106156,9524,1884,Live
57.0,VIVEMOS NUMA DITADURA DA BURGUESIA!,2023-11-07,2439,74,45,Short
61.0,A PM É EFICIENTE NA SEGURANÇA PÚBLICA?,2023-11-06,340,35,4,Short
60.0,ASCENDER NÃO É SOBRE ESFORÇO!,2023-11-06,1085,47,1,Short
2644.0,"ISRAEL CERCA MAIOR CIDADE DE GAZA; ONU FALA EM ""GENOCÍDIO"" - TRENDING TOPICS - #119 #TT",2023-11-04,1684,103,5,Short
266.0,BRIGA ENTRE TORCEDORES DO FLUMINENSE E BOCA JUNIORS #TT,2023-11-03,505,24,3,Short
207.0,CARLA ZAMBELLI COMPARA PALESTINOS A RATOS #TT,2023-11-03,602,55,20,Short
150.0,COLÔMBIA DECIDE SACRIFICAR HIPOPÓTAMOS #TT,2023-11-03,212,32,3,Short
964.0,A GERAÇÃO SNOWFAKE! - BIGORNA DA REALIDADE - #19 #BR,2023-11-03,1410,207,9,Short
425.0,É POSSÍVEL SIM VENCER A CORRUPÇÃO!,2023-11-02,446,27,2,Short
313.0,"VAMOS AVANÇAR, MAS É PRECISO PACIÊNCIA!",2023-11-02,269,26,7,Short
234.0,NEM TUDO É UM GRANDE GESTO POLÍTICO,2023-11-02,325,24,3,Short
427.0,É POSSÍVEL TER TARIFA ZERO NO TRANSPORTE PÚBLICO? #FN,2023-11-02,740,44,10,Short
542.0,O QUE OS AMERICANOS ACHAM DO PRESIDENTE BIDEN?,2023-11-02,289,19,1,Short
692.0,BOLSONARO ESTÁ SENDO PERSEGUIDO? #FN,2023-11-02,487,35,6,Short
5530.0,"ABEL NETO - CONEXÕES, COM GLORIA VANIQUE - #22 #CX",2023-11-02,1636,161,5,Live
354.0,EU TINHA UMA BANDA DE JAZZ! #CX,2023-11-02,103,4,0,Short
457.0,TEM GENTE QUE NUNCA VIU UMA PESSOA NEGRA NA VIDA EM PEQUIM #CX,2023-11-02,112,8,1,Short
335.0,"SE O TIME PERDER, A CULPA É DO JORNALISTA! #CX",2023-11-02,58,3,0,Short
2321.0,ABERTURA DA FRONTEIRA! ESTRANGEIROS COMEÇAM A DEIXAR GAZA - TRENDING TOPICS - #118 #TT,2023-11-02,807,87,1,Short
4029.0,TSE CONDENA BOLSONARO E BRAGA NETTO À INELEGIBILIDADE POR ATOS NO 7 DE SETEMBRO- FLOW NEWS- #125 #FN,2023-11-01,2094,191,3,Live
106.0,GOVERNO LULA AUMENTA IMPOSTOS SOBRE ARMAS DE FOGO #TT,2023-11-01,139,6,1,Short
230.0,BOLSONARO E BRAGA NETTO ESTÃO VETADOS ATÉ 2030 #TT,2023-11-01,158,7,1,Short
397.0,ISRAEL ATACA MAIOR CAMPO DE REFUGIADOS DA FAIXA DE GAZA #TT,2023-11-01,87,4,1,Short
4904.0,"MARIA ADELAIDE AMARAL - PORTAS ABERTAS, COM CARLOS TRAMONTINA - #23 #PA",2023-11-01,4839,422,16,Live
2210.0,MESSI ULTRAPASSA PELÉ EM BOLAS DE OURO | VINI JR PREMIADO - TRENDING TOPICS - #117 #TT,2023-11-01,708,77,2,Short
329.0,AS COMEMORAÇÕES DE HALLOWEEN NO BRASIL #FN,2023-11-01,449,22,5,Short
390.0,O APOIO DOS ESTADOS UNIDOS A ISRAEL #FN,2023-11-01,396,17,3,Short
651.0,A CRISE NO CONSELHO DE SEGURANÇA DA ONU #FN,2023-11-01,258,14,0,Short
4709.0,MESSI CONQUISTA 8ª BOLA DE OURO; LULA: JOGADORES DO BRASIL DEVIAM SE INSPIRAR - FLOW NEWS - #124 #FN,2023-10-31,2476,212,7,Live
58.0,A GUATEMALA E O NARCOTRÁFICO,2023-10-31,835,50,1,Short
741.0,A PROPORÇÃO DE UMA VIDA NA AMÉRICA CENTRAL É MUITO DIFERENTE!,2023-10-31,79,5,1,Short
247.0,OS PAÍSES A NOSSA VOLTA AMAM O BRASIL,2023-10-31,132,5,0,Short
438.0,MESSI ULTRAPASSA PELÉ  #TT,2023-10-31,83,9,2,Short
345.0,HADDAD SE IRRITA EM ENTREVISTA POR DEFENDER FALA DE LULA #TT,2023-10-31,222,13,1,Short
186.0,CANDIDATA É IMPEDIDA DE CONCORRER COM MADURO #TT,2023-10-31,439,26,1,Short
630.0,EXISTE CLIMA DE RIVALIDADE EM BRASÍLIA? #FN,2023-10-31,635,54,2,Short
376.0,O RELATÓRIO DA SENADORA ELIZIANE GAMA SOBRE ATOS DE 8 DE JANEIRO #FN,2023-10-31,592,25,3,Short
322.0,SENADOR SÉRGIO MORO FALA SOBRE ATUAÇÃO DO MINISTÉRIO DA JUSTIÇA #FN,2023-10-31,431,21,3,Short
605.0,A LEGISLAÇÃO PENAL BRASILEIRA É FRACA? #FN,2023-10-31,422,21,8,Short
389.0,SÉRGIO MORO COMPARA SUA CARREIRA DE JUIZ COM A DE SENADOR #FN,2023-10-31,404,11,6,Short
3842.0,SERGIO MORO - FORA DA BOLHA - #21 #FB,2023-10-31,8856,788,105,Live
4060.0,SENADOR SERGIO MORO FALA SOBRE CARREIRA E POLÍTICA - FLOW NEWS - #123 #FN,2023-10-30,7070,684,31,Live
302.0,CLASSIFICAÇÃO BRASILEIRÃO SÉRIE A RODADA #30 #TT,2023-10-30,79,4,0,Short
201.0,CARRO DE LUXO FOGE DE BLITZ E PM RESPONDE COM TIROS #TT,2023-10-30,1022,45,10,Short
461.0,"TUDO SOBRE A MORTE DO ATOR MATTHEW PERRY, O CHANDLER DE FRIENDS #TT",2023-10-30,747,60,2,Short
2228.0,TANQUES DE ISRAEL SE APROXIMAM DA MAIOR CIDADE DE GAZA - TRENDING TOPICS - #116 #TT,2023-10-30,2513,147,0,Short
275.0,A TREND DO MOMENTO FEITA COM INTELIGÊNCIA ARTIFICIAL #FN,2023-10-28,941,26,1,Short
936.0,OS SHOWS INTERNACIONAIS MAIS AGUARDADOS DE 2023  #FN,2023-10-28,526,35,1,Short
628.0,AS VÍTIMAS DOS CONFLITOS NA FAIXA DE GAZA #FN,2023-10-28,459,34,5,Short
3727.0,IA CRIA AVATARES NO ESTILO DISNEY PIXAR E VIRA FEBRE NAS REDES SOCIAIS - FLOW NEWS - #122 #FN,2023-10-28,2303,200,15,Live
2321.0,FOGUETE DO HAMAS ATINGE PRÉDIO RESIDENCIAL EM ISRAEL - TRENDING TOPICS - #115 #TT,2023-10-28,1380,105,1,Short
116.0,ISIS VALVERDE TEM SUPOSTOS NUDEZ VAZADOS #TT,2023-10-27,336,13,0,Short
220.0,"JOÃO PESSOA, CAPITAL DA PARAÍBA, PODE TER O NOME ALTERADO #TT",2023-10-27,204,17,2,Short
364.0,FOGUETE DO HAMAS ATINGE PRÉDIO RESIDENCIAL EM ISRAEL #TT,2023-10-27,113,6,0,Short
851.0,DEMOREI DOIS ANOS PRA CONSEGUIR FALAR DA PALESTINA DEPOIS DE VOLTAR DE LÁ!,2023-10-27,1115,50,38,Short
531.0,VAI MUITO ALÉM DO QUE PARECE!,2023-10-27,179,14,0,Short
858.0,“UN PAÍS DE MIERD4”? NÃO SOU EU QUE TÔ DIZENDO! - BIGORNA DA REALIDADE - #18 #BR,2023-10-27,1339,191,13,Short
4935.0,A PRESENÇA DA MILÍCIA NO COTIDIANO DO RIO | O POLÊMICO NOVO ENSINO MÉDIO - TRAMONTA NEWS - #17 #TN,2023-10-27,2659,384,6,Live
429.0,O ATAQUE A TIROS NOS ESTADOS UNIDOS  #FN,2023-10-27,387,36,0,Short
652.0,O AUMENTO DA CRIMINALIDADE NO BRASIL  #FN,2023-10-27,1699,121,33,Short
461.0,BOLSONARO PODE SER CONDENADO MAIS UMA VEZ  #FN,2023-10-27,1013,124,6,Short
250.0,A DECLARAÇÃO POLÊMICA  DO SECRETÁRIO GERAL DA ONU #TN,2023-10-27,467,30,0,Short
553.0,OS ERROS E ACERTOS DO NOVO ENSINO MÉDIO #TN,2023-10-27,318,33,1,Short
556.0,AS DIFICULDADES DOS TRABALHADORES DE APLICATIVOS #TN,2023-10-27,243,18,1,Short
3759.0,EUA: ATAQUE A TIROS DEIXA AO MENOS 18 MORTOS E 13 FERIDOS; ATIRADOR FORAGIDO - FLOW NEWS - #121 #FN,2023-10-26,2756,300,13,Live
244.0,O SUCESSO DO RESTAURANTE FAMIGLIA MANCINI #PA,2023-10-26,157,16,0,Short
367.0,O CONCEITO QUE MUDOU OS RESTAURANTES NO BRASIL #PA,2023-10-26,195,20,1,Short
642.0,COMO SUPERAR AS DIFICULDADES E TER UM RESTAURANTE DE SUCESSO #PA,2023-10-26,75,7,0,Short
418.0,RESUMO DO BRASILEIRÃO E CHAMPIONS LEAGUE #TT,2023-10-26,60,3,0,Short
221.0,LULA DEMITE PRESIDENTE DA CAIXA #TT,2023-10-26,98,5,1,Short
192.0,MILEI TEM APOIO DE TERCEIRA COLOCADA NAS ELEIÇÕES DA ARGENTINA #TT,2023-10-26,74,6,1,Short
2511.0,ISRAEL ENTRA COM TANQUES NA FAIXA DE GAZA E DIVULGA VÍDEOS - TRENDING TOPICS - #114 #TT,2023-10-26,2425,170,1,Short
451.0,CARLA ZAMBELLI TERIA PEDIDO ENDEREÇO DE MORAES PARA HACKER #FN,2023-10-26,881,47,6,Short
817.0,OS INTERESSES POLÍTICOS POR TRÁS DA GUERRA  #FN,2023-10-26,542,25,2,Short
7017.0,"FILIPE MASETTI: VIAGEM AS AMÉRICAS A CAVALO - CONEXÕES, COM GLORIA VANIQUE - #21 #CX",2023-10-26,1118,97,4,Live
2722.0,MILÍCIA: O QUE É? COMO SURGIU? GOVERNO LULA PODE AJUDAR RJ? - TRENDING TOPICS - #113 #TT,2023-10-26,891,100,6,Short
758.0,MAIS UMA MULHER PERDE CARGO NO GOVERNO LULA #FN,2023-10-26,708,61,14,Short
4508.0,"APÓS PRESSÃO DO CENTRÃO, LULA DEMITE PRESIDENTE DA CAIXA ECONÔMICA FEDERAL - FLOW NEWS - #120 #FN",2023-10-25,2493,223,8,Live
238.0,INFLUENCER É BALEADO APÓS BRIGA DE TRÂNSITO #TT,2023-10-25,4869,61,18,Short
699.0,TUDO SOBRE OS ATAQUES DA MILÍCIA NO RIO DE JANEIRO #TT,2023-10-25,101,7,0,Short
378.0,OS REFÉNS LIBERADOS PELO HAMAS #TT,2023-10-25,100,7,1,Short
4390.0,"WALTER MANCINI - PORTAS ABERTAS, COM CARLOS TRAMONTINA - #22 #PA",2023-10-25,2126,166,14,Live
259.0,A ARRECADAÇÃO DO GOVERNO LULA #FN,2023-10-25,368,29,0,Short
344.0,LULA CRITICA ISRAEL PELA CONTRAOFENSIVA NA FAIXA DE GAZA #FN,2023-10-25,318,19,4,Short
573.0,O QUE ESTÁ ACONTECENDO NA GUERRA ISRAEL X HAMAS? #FN,2023-10-25,484,62,3,Short
3859.0,"APÓS MORTE DE MILICIANO, 35 ÔNIBUS SÃO QUEIMADOS EM 1 DIA NO RIO DE JANEIRO - FLOW NEWS - #119 #FN",2023-10-24,2156,239,4,Live
589.0,QUAL A SOLUÇÃO PARA A CRACOLÂNDIA?  #FN,2023-10-24,506,44,3,Short
497.0,AS SEMELHANÇAS ENTRE BOLSONARO E MILEI #FN,2023-10-24,1120,60,5,Short
462.0,QUAL A SOLUÇÃO PARA A CRISE NA ARGENTINA? #FN,2023-10-24,942,82,10,Short
57.0,DUBLAGEM É TRABALHO DE ARTE,2023-10-24,781,71,1,Short
44.0,E O MORO HEIN?,2023-10-24,2717,121,2,Short
57.0,J.K. ROWLING SEMPRE SE POSICIONOU CONTRA PESSOAS TRANS!,2023-10-24,7098,279,141,Short
2829.0,EXTREMA-DIREITA FICA EM 2º NA ARGENTINA | PLANALTO COMEMORA - TRENDING TOPICS - #112 #TT,2023-10-24,1482,146,13,Short
113.0,MOTORISTA ATROPELA 16 PESSOAS NA CRACOLÂNDIA #TT,2023-10-24,275,22,3,Short
660.0,AS ELEIÇÕES PRESIDENCIAIS DA ARGENTINA,2023-10-24,163,10,1,Short
206.0,AJUDA HUMANITÁRIA CHEGA À FAIXA DE GAZA #TT,2023-10-24,86,7,0,Short
5405.0,THIAGO ÁVILA - FORA DA BOLHA - #20 #FB,2023-10-24,9960,843,294,Live
3548.0,ATAQUE EM ESCOLA DE SAPOPEMBA DEIXA UMA ALUNA MORTA E TRÊS FERIDOS - FLOW NEWS - #118 #FN,2023-10-23,3137,300,11,Short
730.0,A RELAÇÃO BRASIL E ARGENTINA COM A VITÓRIA DE MILEI #FN,2023-10-21,2291,165,23,Short
501.0,O DESGASTE DA IMAGEM DAS FORÇAS ARMADAS #FN,2023-10-21,723,51,0,Short
538.0,A RESOLUÇÃO DE PAZ PROPOSTA PELO BRASIL #FN,2023-10-21,736,51,6,Short
433.0,O FURTO DE 21 METRALHADORAS DO EXÉRCITO BRASILEIRO #TN,2023-10-21,393,25,0,Short
555.0,AS NOVAS MODALIDADES DOS JOGOS OLÍMPICOS DE 2028 #TN,2023-10-21,863,71,4,Short
325.0,O PIOR INÍCIO DA SELEÇÃO BRASILEIRA  APÓS A COPA DO MUNDO #TN,2023-10-21,300,30,3,Short
2499.0,PF APURA ESQUEMA DE ESPIONAGEM ILEGAL NA ABIN DE BOLSONARO - TRENDING TOPICS - #111 #TT,2023-10-21,1709,152,1,Short
4029.0,LULA CHAMA HAMAS DE TERRORISTA E DIZ QUE REAÇÃO DE ISRAEL É INSANA - FLOW NEWS - #117 #FN,2023-10-20,7613,647,64,Live
870.0,FELIPE BISNETO PEDE TRÉGUA - BIGORNA DA REALIDADE - #17 #BR,2023-10-20,2560,394,22,Short
378.0,NO HOSTEL A GENTE CONHECEU VÁRIOS BRASILEIROS E FOMOS TROCANDO SOBRE AS CULTURAS #CN,2023-10-20,514,30,1,Short
213.0,TEM MUITA SUPERSTIÇÃO NA RÚSSIA! #CX,2023-10-20,396,29,2,Short
4696.0,SELEÇÃO BRASILEIRA PIORA DESEMPENHO | NEYMAR LESIONADO | OLIMPÍADAS 2028 - TRAMONTA NEWS - #16 #TN,2023-10-20,2082,245,6,Live
4030.0,"AO LADO DO PRIMEIRO MINISTRO BRITÂNICO, NETANYAHU DIZ: ""A GUERRA SERÁ LONGA"" - FLOW NEWS - #116 #FN",2023-10-19,4206,418,7,Live
2665.0,RÚSSIA ENVIA CAÇAS EM RESPOSTA A PORTA-AVIÕES DOS EUA EM ISRAEL - TRENDING TOPICS - #110 #TT,2023-10-19,4332,280,8,Short
6380.0,"KATIUSHA (A RUSSA) - CONEXÕES, COM GLORIA VANIQUE - #20 #CX",2023-10-19,120611,6007,293,Live
3633.0,EUA VETAM RESOLUÇÃO DO BRASIL SOBRE ISRAEL X HAMAS NA ONU - FLOW NEWS - #115 #FN,2023-10-18,4673,468,12,Live
379.0,É PERIGOSO PARA O REGIME DO IRÃ A RELAÇÃO DE ISRAEL COM ARÁBIA SAUDITA #foradabolha,2023-10-18,864,44,2,Short
442.0,A POLARIZAÇÃO CRIA UM PROCESSO DE ENCOLHIMENTO HUMANO #fb,2023-10-18,308,21,4,Short
470.0,EXISTE UM GRANDE FINACIAMENTO DO IRÃ NO QUE ESTÁ ACONTECENDO NO ORIENTE MÉDIO! #fb,2023-10-18,589,50,2,Short
2472.0,EXPLOSÃO EM HOSPITAL DE GAZA | CLIMÃO COM BIDEN EM ISRAEL - TRENDING TOPICS - #109 #TT,2023-10-18,2386,252,4,Short
3810.0,RELATORA DA CPMI DO 8/1 PEDE INDICIAMENTO DE BOLSONARO E DE MAIS 60 PESSOAS - FLOW NEWS - #114 #FN,2023-10-17,5757,413,14,Live
4992.0,"MABEL CEZAR (A VOZ DA REDE GLOBO) - PORTAS ABERTAS, COM CARLOS TRAMONTINA - #21 #PA",2023-10-17,6640,721,23,Live
403.0,SÃO UMAS CINCO CAMADAS DE ROUPA PRA PODER ESCALAR!,2023-10-17,598,43,0,Short
614.0,TEMOS QUE DORMIR PELADOS E NO SACO DE DORMIR,2023-10-17,285,20,0,Short
408.0,TEVE UM DIA QUE EU QUIS TOMAR UMA TAÇA DE VINHO NO DIA ANTES DA CORRIDA!,2023-10-17,342,39,0,Short
56.0,COMO MEU PAI ME AJUDOU COM AMOR PRÓPRIO!,2023-10-17,584,31,1,Short
53.0,EU PRECISAVA ENTENDER COMO ACOLHER A MINHA FILHA COM SÍNDROME DE DOWN,2023-10-17,981,49,1,Short
2444.0,HAMAS DIVULGA VÍDEO DE REFÉM ISRAELENSE PELA 1ª VEZ - TRENDING TOPICS - #108 #TT,2023-10-17,6783,446,12,Short
2355.0,"EM MEIO A BOMBAS, ABERTURA DA FRONTEIRA DE GAZA É AGUARDADA - TRENDING TOPICS - #107 #TT",2023-10-17,2125,154,2,Short
4982.0,ANDRÉ LAJST (ISRAEL X HAMAS) - FORA DA BOLHA - #19 #FB,2023-10-17,66648,5286,205,Live
3707.0,BLINKEN E NETANYAHU SE PROTEGEM EM BUNKER DURANTE REUNIÃO EM TEL AVIV - FLOW NEWS - #113 #FN,2023-10-16,6389,562,25,Live
233.0,A POLÊMICA DO FELIPE NETO E A BIS #TT,2023-10-16,17128,586,140,Short
282.0,PROPOSTA DE CESSAR FOGO SERÁ VOTADA HOJE #TT,2023-10-16,652,45,2,Short
279.0,GUERRA CHEGA AO LÍBANO E SÍRIA #TT,2023-10-16,501,48,1,Short
427.0,A POSIÇÃO DA ONU DIANTE DA GUERRA ISRAEL X HAMAS #FN,2023-10-14,1623,125,4,Short
777.0,ATÉ QUE PONTO A RESPOSTA DE ISRAEL É JUSTA? #FN,2023-10-14,2421,152,13,Short
664.0,ÁUDIO EXCLUSIVO E EMOCIONANTE DE MORADORA DA FAIXA DE GAZA #FN,2023-10-14,855,50,3,Short
4514.0,ISRAEL DÁ PRAZO DE 24H PARA MORADORES DEIXAREM CIDADE DE GAZA E ARREDORES - FLOW NEWS - #112 #FN,2023-10-13,14263,954,57,Live
155.0,MOTORISTA ATROPELA GRUPO DE MULHERES EM SALÃO DE BELEZA #TT,2023-10-13,233,7,0,Short
280.0,MAIS BRASILEIROS SÃO VÍTIMAS DE ATAQUES EM ISRAEL #TT,2023-10-13,142,10,1,Short
360.0,ISRAEL ORDENA EVACUAÇÃO DE GAZA #TT,2023-10-13,358,41,9,Short
836.0,O TERROR DO HAMAS EM ISRAEL! - BIGORNA DA REALIDADE - #16 #BR,2023-10-13,2859,374,28,Short
2543.0,"PREPARADO PARA INVASÃO, ISRAEL ORDENA EVACUAÇÃO EM GAZA - TRENDING TOPICS - #106 #TT",2023-10-13,3245,181,2,Short
6650.0,"CARLOS TRAMONTINA - CONEXÕES, COM GLORIA VANIQUE - #19 #CX",2023-10-12,13628,424,11,Live
640.0,A PROIBIÇÃO DO CASAMENTO HOMOAFETIVO #FN,2023-10-12,719,48,9,Short
301.0,A POSIÇÃO DO BRASIL DIANTE DA GUERRA ISRAEL X HAMAS #FN,2023-10-12,911,63,5,Short
723.0,O QUE É O HAMAS? #FN,2023-10-12,703,51,1,Short
532.0,OS PRECONCEITOS SOFRIDOS DURANTE A INFÂNCIA #PA,2023-10-12,247,28,1,Short
687.0,A VIRADA DE CHAVE NA VIDA DE MARCOS ROSSI #PA,2023-10-12,173,9,1,Short
279.0,COMO MARCOS ROSSI SUPERA TODAS AS SUAS DIFICULDADES #PA,2023-10-12,553,24,0,Short
3924.0,EXÉRCITO DE ISRAEL DIZ QUE HÁ BRASILEIROS ENTRE REFÉNS DO HAMAS - FLOW NEWS - #111 #FN,2023-10-11,4890,333,0,Live
163.0,KAYKY BRITO FAZ PRIMEIRA APARIÇÃO APÓS ACIDENTE #TT,2023-10-11,223,15,1,Short
376.0,IMAGENS INÉDITAS DOS ATAQUES DO HAMAS #TT,2023-10-11,286,22,1,Short
235.0,CÂMARA APROVA PROJETO PARA PROIBIR CASAMENTO HOMOAFETIVO #TT,2023-10-11,137,6,2,Short
2279.0,IMAGENS INÉDITAS DE INVASÃO DO HAMAS | LÍBANO NA GUERRA? - TRENDING TOPICS - #105 #TT,2023-10-11,1767,126,1,Short
45.0,OS SOLDADOS DE ISAREL,2023-10-11,2436,157,0,Short
57.0,O CLIMA ENTRE OS HABITANTE DE ISRAEL,2023-10-11,613,58,1,Short
58.0,O CLIMA ENTRE OS CIDADÃOS DA CISJORDÂNIA,2023-10-11,175,17,1,Short
60.0,O CONFLITO ENTRE ISRAEL E HAMAS,2023-10-11,894,41,3,Short
4150.0,"MARCOS ROSSI - PORTAS ABERTAS, COM CARLOS TRAMONTINA - #20 #PA",2023-10-11,1419,117,5,Live
2488.0,"BRASILEIRO MORRE EM ISRAEL, QUE INTENSIFICA ATAQUES EM GAZA - TRENDING TOPICS - #104 #TT",2023-10-11,1449,107,2,Short
855.0,QUAL O PRINCIPAL OBJETIVO DOS ATAQUES DO HAMAS? #FN,2023-10-11,376,22,4,Short
421.0,O QUE MUDA NESSA NOVA FASE DA GUERRA ENTRE ISRAEL X HAMAS? #FN,2023-10-11,207,16,0,Short
414.0,QUAIS AS CONSEQUÊNCIAS DA GUERRA ISRAEL X HAMAS PARA O MUNDO? #FN,2023-10-11,677,64,7,Short
3762.0,CONFLITO ISRAEL-HAMAS CHEGA AO 4° DIA; BRASILEIROS SÃO ENCONTRADOS MORTOS - FLOW NEWS - #110 #FN,2023-10-10,4719,356,6,Live
182.0,OPERAÇÃO EM BUSCA DOS RESPONSÁVEIS PELAS MORTES DE MÉDICOS #TT,2023-10-10,85,6,0,Short
209.0,COMO A GUERRA PODE AFETAR O BRASIL #TT,2023-10-10,270,26,0,Short
161.0,O QUE PODE ACONTECER CASO IRÃ ENTRE NA GUERRA? #TT,2023-10-10,159,10,1,Short
5183.0,ALDO REBELO - FORA DA BOLHA - #18 #FB,2023-10-10,14052,1282,150,Live
2516.0,ISRAEL FAZ CERCO EM GAZA EM RESPOSTA AO ATAQUE DO HAMAS - TRENDING TOPICS - #103 #TT,2023-10-10,1914,153,2,Short
616.0,BRASILEIRA EM ISRAEL CONTA COMO ESTÁ A SITUAÇÃO DOS CONFLITOS #FN,2023-10-10,727,69,1,Short
650.0,COMO ESTÁ SENDO O DIA A DIA DIANTE DA GUERRA ISRAEL X HAMAS #FN,2023-10-10,148,12,0,Short
499.0,ESPECIALISTA EXPLICA TUDO SOBRE O CONFLITO EM ISRAEL #FN,2023-10-10,343,20,0,Short
3937.0,ISRAEL X HAMAS: CONFRONTOS NO ORIENTE MÉDIO DEIXA MAIS DE 1.300 MORTOS - FLOW NEWS - #109 #FN,2023-10-09,5398,508,7,Live
727.0,COMO O ESTADO PODE COMBATER O CRIME ORGANIZADO?  #FN,2023-10-07,844,69,6,Short
581.0,A POLÊMICA DA DANÇA SENSUAL NO MINISTÉRIO DA SAÚDE #FN,2023-10-07,5214,279,88,Short
593.0,O NOVO SMARTPHONE DA GOOGLE COM INTELIGÊNCIA ARTIFICIAL #FN,2023-10-07,603,47,4,Short
2215.0,TRIBUNAL DO TRÁFICO EXECUTA OS EXECUTORES DE MÉDICOS NO RIO - TRENDING TOPICS - #102 #TT,2023-10-07,1104,94,4,Short
