Duration,Title,Published_date,Views,Likes,Comments,Type
383.0,BOLSONARO LEVA BRONCA DE MICHELE BOLSONARO EM EVENTO #TT,2023-08-01,356,25,10,Short
413.0,APÓS M0RTE DE POLICIAL OPERAÇÃO NO GUARUJÁ DEIXA 8 MORT0S #TT,2023-08-01,205,13,10,Short
212.0,APÓS AGRESSÃO DE PREPARADOR FÍSICO PEDRO É PUNIDO #TT,2023-08-01,90,7,0,Short
2806.0,SOCO NO VESTIÁRIO: A TRETA DE PEDRO E PREPARADOR DE SAMPAOLI NO FLAMENGO - TRENDING TOPICS - #54 #TT,2023-08-01,670,87,2,Short
276.0,THREADS PERDE RELEVÂNCIA E USUÁRIOS DEIXAM A REDE SOCIAL #FN,2023-08-01,659,44,3,Short
657.0,PL DAS FAKE NEWS VOLTA  A SER PAUTA DO GOVERNO #FN,2023-08-01,184,12,4,Short
817.0,BOLSONARO ESCONDE PROJEÇÕES DE M0RTES NA P@ANDEMIA #FN,2023-08-01,1021,112,32,Short
4098.0,PP E REPUBLICANOS DEVEM INTEGRAR O GOVERNO LULA EM ATÉ 10 DIAS - FLOW NEWS - #60 #FN,2023-07-31,1517,158,3,Live
389.0,O USO DE INTELIGÊNCIA ARTIFICIAL PARA “RESSUSCITAR” MÚSICAS DE ARTISTAS #TN,2023-07-29,410,34,4,Short
539.0,A TRAJETÓRIA DE THUNDERBIRD NA MTV E O FIM DA EMISSORA,2023-07-29,981,58,4,Short
454.0,BRASILEIROS ESTÃO NA LISTA DE MELHORES CIENTISTAS DO MUNDO #TN,2023-07-29,359,47,2,Short
236.0,LULA RECEBE CRÍTICAS APÓS ESCOLHA DE NOVO PRESIDENTE DO IBGE #TT,2023-07-29,160,9,1,Short
175.0,MAURO CID FAZ MOVIMENTAÇÃO MILIONÁRIA E CAUSA SUSPEITA #TT,2023-07-29,552,23,3,Short
4366.0,"PARA REGULAR AS REDES, GOVERNO ESTUDA ATUAÇÃO DA CGU NO PL DAS FAKE NEWS - FLOW NEWS - #59 #FN",2023-07-29,1335,167,13,Live
692.0,SELEÇÃO BRASILEIRA ENFRENTA FRANÇA NESTE SÁBADO #TT,2023-07-29,62,2,0,Short
1940.0,BRASIL x FRANÇA: PRÉ-JOGO DO 1º CLÁSSICO DA SELEÇÃO NA COPA FEMININA - TRENDING TOPICS - #53 #TT,2023-07-29,557,68,0,Short
1112.0,O BRASIL É UM PAÍS RACISTA? #FN,2023-07-29,871,106,11,Short
475.0,LULA IRÁ SE REUNIR COM REPUBLICANOS PARA REFORMAR MINISTÉRIOS #FN,2023-07-29,120,8,0,Short
509.0,JULHO É O MÊS MAIS QUENTE JÁ REGISTRADO NA HISTÓRIA #FN,2023-07-28,618,58,5,Short
845.0,HOLIDAY & OS MORTOS-VIVOS BOLSONARISTAS! - #05 #BR,2023-07-28,5785,885,60,Short
3783.0,AS NOVAS REGRAS DO GOVERNO PARA EMPRESAS E APOSTADORES ESPORTIVOS - TRAMONTA NEWS - #07 #TN,2023-07-28,1268,166,7,Live
2202.0,LULA ZERA VERBA DE PUBLICIDADE DA JOVEM PAN APÓS MILHÕES DE BOLSONARO - TRENDING TOPICS - #52 #TT,2023-07-28,1801,182,26,Short
417.0,O QUE  FAZ E COMO SE TORNAR UMA INFLUENCER DE VIAGEM #CX,2023-07-28,150,5,0,Short
337.0,O QUE ACONTECEU COM JAKE APÓS A SAÍDA DO BBB #CX,2023-07-28,138,2,0,Short
5901.0,KEVIN SPACEY INOCENTE? | POLLY POCKET VAI GANHAR FILME - #09 #KN,2023-07-28,4719,604,44,Live
491.0,JAKE LEAL CONTA TRANSTORNO DURANTE ENTRADA NO BBB #CX,2023-07-28,125,1,0,Short
119.0,SUÁREZ IRÁ TROCAR GRÊMIO POR INTER MIAMI? #TT,2023-07-28,115,4,0,Short
302.0,PRESIDENTE DA UCRÂNIA COGITA LULA COMO INTERMEDIADOR DA GUERRA #TT,2023-07-28,189,12,3,Short
566.0,JOVEM PAN PERDE VERBA DO GOVERNO LULA #TT,2023-07-28,437,26,10,Short
331.0,GOVERNO DEVE APRESENTAR NOVO PLANO PARA MORADORES DE RUA #FN,2023-07-28,292,8,2,Short
267.0,DILMA SE REÚNE COM  PUTIN PARA DISCUTIR TRANSAÇÕES SEM DÓLAR #FN,2023-07-28,159,8,2,Short
541.0,NOTA DO BRASIL AUMENTA PARA INVESTIDORES #FN,2023-07-27,288,23,9,Short
3939.0,EX-MILITAR DIZ QUE O GOVERNO ESCONDE INFORMAÇÕES DE OVNIS E CORPOS NÃO HUMANOS - FLOW NEWS - #58 #FN,2023-07-27,2260,286,4,Live
4467.0,"JAKE LEAL - CONEXÕES, COM GLORIA VANIQUE - #08 #CX",2023-07-27,775,79,1,Live
513.0,O DESENVOLVIMENTO DO MERCADO ATUAL DE PODCAST #PA,2023-07-27,648,48,0,Short
482.0,O SURGIMENTO DO FLOW #PA,2023-07-27,325,31,0,Short
818.0,AS DIFICULDADES DO PROJETO 60 DIAS COM RENATO CARIANI #PA,2023-07-27,1089,110,6,Short
2886.0,CASO MARIELLE: RONNIE LESSA PERDE ÁLIBI E PODE FAZER DELAÇÃO PREMIADA - TRENDING TOPICS - #51 #TT,2023-07-27,757,77,0,Short
361.0,NOVAS REGRAS PARA CASAS DE APOSTAS #TT,2023-07-27,128,10,0,Short
160.0,NOVA TOCHA DOS JOGOS OLÍMPICOS DE PARIS EM 2024 #TT,2023-07-27,73,3,0,Short
255.0,LULA PASSA POR PROCEDIMENTO MÉDICO #TT,2023-07-27,231,5,3,Short
424.0,PREFEITURA TOMA MEDIDA EM PRAÇAS COM MORADORES DE RUA #FN,2023-07-27,150,12,1,Short
527.0,GOVERNO LULA E O JOGO DE INTERESSES COM O CENTRÃO #FN,2023-07-27,197,5,3,Short
462.0,LULA DEFENDE FIM DE CLUBES DE T1RO #FN,2023-07-27,246,8,11,Short
3678.0,AGÊNCIA FITCH ELEVA NOTA DE CRÉDITO DO BRASIL E ANIMA HADDAD - FLOW NEWS - #57 #FN,2023-07-26,1469,150,5,Live
207.0,PROJETOS ADIADOS PELA GREVE DOS ATORES! #KN,2023-07-26,405,32,1,Short
96.0,NETFLIX E O CORTE DE ORÇAMENTO! #KN,2023-07-26,293,27,0,Short
424.0,ENTREVISTAMOS ELENCO E EQUIPE DE ALÉM DO GUARDA-ROUPA #KN,2023-07-26,3340,286,6,Short
59.0,CONTEXTO DE SURGIMENTO DO FLOW NEWS,2023-07-26,1274,110,0,Short
379.0,O FILME DA BARBIE PROMOVE UMA AGENDA ANTI HOMEM? #FB,2023-07-26,1196,77,10,Short
557.0,O FUTURO DA EDUCAÇÃO NO BRASIL #FB,2023-07-26,247,16,1,Short
492.0,AS DIVERGÊNCIAS IDEOLÓGICAS E AMEAÇAS SOFRIDAS NA POLÍTICA #FB,2023-07-26,388,34,5,Short
202.0,MUDANÇAS NO ANTIGO TWITTER COMEÇAM A SER FEITAS #TT,2023-07-26,180,16,2,Short
2556.0,DELAÇÃO DO CASO MARILLE REVELA NOVOS DETALHES SOBRE O CRIME - TRENDING TOPICS - #50 #TT,2023-07-26,856,105,1,Short
190.0,MBAPPE RECEBE PROPOSTA DE TIME ÁRABE #TT,2023-07-26,97,6,0,Short
269.0,SUSPEITO DE M*TAR TORCEDORA DO PALMEIRAS É PRESO #TT,2023-07-26,100,8,0,Short
292.0,É POSSÍVEL TRABALHAR NOS EUA COM UM DIPLOMA DO BRASIL? #FN,2023-07-26,155,10,0,Short
392.0,ROMEU ZEMA SE ENVOLVE EM POLÊMICA NAS REDES SOCIAIS #FN,2023-07-26,228,17,3,Short
499.0,QUEM MANDOU M*TAR MARIELLE? #FN,2023-07-25,313,41,3,Short
3942.0,LULA DIZ QUE CLUBES DE T*RO DEVEM EXISTIR SÓ PARA A POLÍCIA E EXÉRCITO - FLOW NEWS - #56 #FN,2023-07-25,2129,221,8,Live
4260.0,"IGOR 3K - PORTAS ABERTAS, COM CARLOS TRAMONTINA - #09 #PA",2023-07-25,25575,2546,61,Live
59.0,O MINISTRO DA JUSTIÇA SOBRE O CASO MARIELLE,2023-07-25,2051,43,6,Short
59.0,OS ABUSADORES SAEM IMPUNES NO BRASIL,2023-07-25,875,42,5,Short
2511.0,SELEÇÃO BRASILEIRA DÁ SHOW E GOLEIA EM ESTREIA NA COPA DO MUNDO FEMININA - TRENDING TOPICS - #49 #TT,2023-07-25,620,99,1,Short
171.0,ELON MUSK MUDA LOGO DO TWITTER #TT,2023-07-25,236,18,1,Short
200.0,EXTREMA DIREITA PERDE FORÇA NA ESPANHA #TT,2023-07-25,95,6,0,Short
416.0,BRASIL VENCE PANAMÁ POR 4 A 0 #TT,2023-07-25,99,6,0,Short
4661.0,"TABATA AMARAL, PRÉ-CANDIDATA À PREFEITURA DE SÃO PAULO - FORA DA BOLHA - #08 #FB",2023-07-25,21603,1800,252,Live
196.0,AS CHANCES DA SELEÇÃO BRASILEIRA VENCER A COPA #FN,2023-07-25,155,7,0,Short
390.0,GOVERNO MUDA DECRETO DE POSSE DE ARMAS #FN,2023-07-24,153,10,3,Short
3762.0,ELON MUSK TROCA O LOGOTIPO DO TWITTER POR ‘’X’’ - FLOW NEWS - #55 #FN,2023-07-24,2094,219,12,Live
528.0,O DIGITAL IRÁ SUBSTITUIR A MÍDIA TRADICIONAL? #FN,2023-07-24,199,26,0,Short
3972.0,EXPECTATIVAS PARA A ESTREIA DO BRASIL NA COPA FEMININA - FLOW NEWS - #54 #FN,2023-07-22,1312,139,7,Live
392.0,É CERTO O FIM DAS ESCOLAS CÍVICO MILITARES? #TN,2023-07-22,1671,102,19,Short
1976.0,SELEÇÃO BRASILEIRA VAI ESTREAR! O QUE ESPERAR NA COPA DO MUNDO FEMININA? - TRENDING TOPICS - #48 #TT,2023-07-22,545,68,1,Short
254.0,EMPRESAS OPTAM POR PONTO FACULTATIVO EM JOGOS DO BRASIL #TN,2023-07-22,344,21,0,Short
302.0,EDGARD PICCOLI FALA SOBRE SUA PARTICIPAÇÃO NA JOVEM PAN #TN,2023-07-22,27388,1557,267,Short
283.0,DOCUMENTÁRIO RELACIONA YOUTUBER CORE COM MA$SACRЄ EM REALENGO #TT,2023-07-22,387,20,1,Short
229.0,JEAN WYLLYS É ACUSADO DE HOMOFOBIA POR EDUARDO LEITE #TT,2023-07-22,234,16,1,Short
593.0,O QUE ESPERAR DO BRASIL NA COPA DO MUNDO DE FUTEBOL FEMININO #TT,2023-07-21,415,30,1,Short
758.0,POLÊMICA DE MICHELLE BOLSONARO | NIKOLAS FERREIRA PAI - #04 #BR,2023-07-21,1710,226,13,Short
3772.0,COPA DO MUNDO FEMININA | NÁUFRAGO DA VIDA REAL - TRAMONTA NEWS - #06 #TN,2023-07-21,1965,207,10,Live
476.0,O JOGO DE INTERESSES ENTRE LULA E CONGRESSO #FN,2023-07-21,158,11,0,Short
399.0,O MAIOR PROBLEMA DO BRASIL #FN,2023-07-21,412,43,3,Short
415.0,SÉRGIO CABRAL SERÁ HOMENAGEADO POR ESCOLA DE SAMBA #FN,2023-07-21,481,50,6,Short
2666.0,BARBIE: POR QUE FILME É O MAIS AGUARDADO POR ADULTOS E CRIANÇAS? - #47 #TT,2023-07-21,1372,99,3,Short
404.0,BARBIE É O FILME MAIS AGUARDADO DO ANO? TT,2023-07-21,302,22,1,Short
365.0,LULA AGRADECE ÁFRICA PELA ESCRAVIDÃO #TT,2023-07-21,181,12,5,Short
571.0,ESTREIA  DA COPA DO MUNDO DE FUTEBOL FEMININA 2023 #TT,2023-07-21,160,6,0,Short
571.0,LULA É O PRINCIPAL LÍDER DA ESQUERDA?,2023-07-21,244,14,1,Short
7119.0,BARBIE VS. OPPENHEIMER! VEM SABER TUDO SOBRE OS FILMES! - KINO - #08 #KN,2023-07-21,7635,762,20,Live
552.0,O QUE CAUSOU O SUPOSTO ATAQUE AO MINISTRO ALEXANDRE DE MORAES #FN,2023-07-21,214,13,2,Short
620.0,O PADRÃO DE BELEZA DETERMINADO PELA BARBIE #FN,2023-07-21,271,14,0,Short
4028.0,"CASOS CONTRA MULHER, CRIANÇAS E ADOLESCENTES CRESCERAM EM 2022 - FLOW NEWS - #53 #FN",2023-07-20,1602,215,11,Live
4273.0,"GABRIEL SANTINI: SAMPA DICAS - CONEXÕES, COM GLORIA VANIQUE - #07 #CX",2023-07-20,2153,174,1,Live
2216.0,"LULA CHAMA SUSPEITOS DE ""ANIMAIS SELVAGENS""; DEPOIMENTO CONTRADIZ MORAES - TRENDING TOPICS - #46 #TT",2023-07-20,820,91,2,Short
133.0,SUÁREZ PODE TROCAR GRÊMIO POR INTER MIAMI #TT,2023-07-20,252,8,0,Short
366.0,LULA DEFENDE RÚSSIA APÓS CRÍTICA DE PRESIDENTE CHILENO #TT,2023-07-19,112,6,0,Short
534.0,CASAL SUSPEITO DE AGRESSÃO CONTRADIZ DEPOIMENTO DE MORAES #TT,2023-07-19,102,7,2,Short
4018.0,"ALÉM DOS CINEMAS, FILME DA BARBIE DEVE DAR LUCRO DE ATÉ US$ 1 BI PARA MATTEL - FLOW NEWS - #52 #FN",2023-07-19,1753,173,4,Live
58.0,VOCÊ COLOCA UM BLAZER E TODO MUNDO COMEÇA A TE RESPEITAR,2023-07-19,1038,68,5,Short
60.0,NO INTERIOR DO PAÍS SER MODELO É IMPENSÁVEL,2023-07-19,850,53,2,Short
325.0,AS CHANCES DE MICHELLE BOLSONARO NA PRESIDÊNCIA #FN,2023-07-19,349,28,2,Short
700.0,LULA PEDE ELEIÇÕES TRANSPARENTES NA VENEZUELA #FN,2023-07-19,230,20,0,Short
55.0,LULA E A AMÉRICA LATINA,2023-07-19,1480,43,9,Short
750.0,OS CUIDADOS PARA NÃO SER ALVO DE QUADRILHAS EM AEROPORTOS #FN,2023-07-19,460,32,1,Short
2001.0,DAMARES ALVES GANHA FORÇA COMO CANDIDATA À PRESIDÊNCIA PARA 2026 - TRENDING TOPICS - #45 #TT,2023-07-19,907,107,9,Short
50.0,DAMARES É A FAVORITA PRA SUBSTITUIR BOLSONARO,2023-07-18,400,19,3,Short
125.0,ÍCONE DA MPB MORRE AOS 88 ANOS #TT,2023-07-18,130,3,1,Short
4521.0,"EM BRUXELAS, PRESIDENTES PEDEM ELEIÇÕES TRANSPARENTES AO GOVERNO VENEZUELANO - FLOW NEWS - #51 #FN",2023-07-18,2786,332,8,Live
209.0,QUEDA DE PREÇOS DOS ALIMENTOS IMPULSIONA BAIXA DA INFLAÇÃO #TT,2023-07-18,145,7,1,Short
243.0,APOIADOR DO BOLSONARO VIRALIZA APÓS CRITICAR PAULO GUEDES #TT,2023-07-18,146,10,1,Short
775.0,QUEM SERÁ O PRÓXIMO NOME DA DIREITA? #FB,2023-07-18,1985,204,14,Short
346.0,RENAN SANTOS FALA COMO COMEÇOU O MOVIMENTO #FB,2023-07-18,1175,101,3,Short
273.0,OS DESAFIOS PARA CONSEGUIR CRESCER O MBL #FB,2023-07-18,733,70,3,Short
58.0,RENAN SANTOS FALA SOBRE O BOLSONARISMO,2023-07-18,4044,154,15,Short
412.0,SERGIO MORO SERÁ JULGADO E PODERÁ SER CASSADO #FN,2023-07-18,526,26,4,Short
515.0,O QUE REPRESENTA PARA A DEMOCRACIA A AGRESSÃO A ALEXANDRE DE MORAES #FN,2023-07-18,589,16,13,Short
59.0,SERGIO MORO E SUA TRAJETÓRIA POLITICA,2023-07-18,2966,85,5,Short
193.0,ESPECIALISTA FALA COMO É FEITO UMA PESQUISA DE OPINIÃO PÚBLICA #FN,2023-07-18,101,7,0,Short
54.0,EX-BBB FELIPE PRIOR E SUAS ACUSAÇÕES,2023-07-18,1103,27,0,Short
2096.0,MINISTRO ALEXANDRE DE MORAES E FILHO SÃO AGREDIDOS NO AEROPORTO DE ROMA - TRENDING TOPICS - #44 #TT,2023-07-18,1286,123,2,Short
6040.0,RENAN SANTOS - FORA DA BOLHA - #07 #FB,2023-07-18,50430,6037,465,Live
4071.0,MULHER QUE ACUSOU O EX-BBB DEU DETALHES DO QUE ACONTECEU - FLOW NEWS - #50 #FN,2023-07-17,2093,201,7,Live
98.0,MESSI É APRESENTADO NO INTER MIAMI #TT,2023-07-17,160,12,0,Short
293.0,CLASSIFICAÇÃO BRASILEIRÃO RODADA #15 #TT,2023-07-17,124,20,0,Short
60.0,ALEXANDRE DE MORAES AGREDIDO EM ROMA,2023-07-17,3056,91,14,Short
429.0,ALEXANDRE DE MORAES E FILHO SÃO AGREDIDOS #TT,2023-07-17,215,19,0,Short
59.0,EXPERIÊNCIA DE QUASE-MORTE NA ÁFRICA,2023-07-17,8742,491,4,Short
347.0,EMPRESÁRIO É CONDENADO POR EXPLORAR MULHERES #FN,2023-07-15,658,44,3,Short
394.0,LULA RETOMA PROGRAMAS QUE IMPORTA MÉDICOS CUBANOS #FN,2023-07-15,557,38,6,Short
302.0,O CENTRÃO PODE ASSUMIR O MINISTÉRIO DO MEIO AMBIENTE?,2023-07-15,292,17,0,Short
225.0,SÃO PAULO ELIMINA PALMEIRAS PELA COPA DO BRASIL #TT,2023-07-15,147,9,1,Short
213.0,CICLONE CONTINUA FAZENDO ESTRAGOS NO SUL DO PAÍS #TT,2023-07-15,166,22,0,Short
60.0,"FABIO TURCI, EX-JORNALISTA DA GLOBO, LANÇA CONTEÚDO NA INTERNET!",2023-07-15,2084,91,5,Short
860.0,MEMBRO DO MBL É AGREDIDO EM UNIVERSIDADE #TT,2023-07-15,1246,75,30,Short
3744.0,EMPRESÁRIO TERÁ QUE PAGAR R$ 30 MILHÕES PARA A JUSTIÇA - FLOW NEWS - #49 #FN,2023-07-15,2197,248,10,Live
2086.0,"INFLUENCIADOR DO MBL AGREDIDO NUM ""ATO DE FISCALIZAÇÃO"" EM UNIVERSIDADE - TRENDING TOPICS - #43 #TT",2023-07-15,3125,268,77,Short
408.0,AS INDICAÇÕES E INJUSTIÇAS DO EMMY 2023 #KN,2023-07-14,2922,217,8,Short
58.0,A FALTA DE OPORTUNIDADE NO BRASIL,2023-07-14,876,56,0,Short
150.0,COMO OS  ESTADOS UNIDOS ENXERGAM O BRASIL #TN,2023-07-14,1310,111,7,Short
140.0,COMO A LEGALIZAÇÃO DA POSSE DE ARMAS AFETOU A VIOLÊNCIA NO BRASIL #TN,2023-07-14,281,13,6,Short
267.0,BRASIL FICA NAS ÚLTIMAS  COLOCAÇÕES DOS PAÍSES MAIS SEGUROS DO MUNDO #TN,2023-07-14,197,18,0,Short
988.0,O FIM DAS ESCOLAS CÍVICO MILITARES #FN,2023-07-14,411,31,6,Short
255.0,LULA ESTÁ SABENDO FAZER UM BOM GOVERNO?,2023-07-14,855,45,6,Short
323.0,LULA ANUNCIA NOVO MINISTRO DO TURISMO #FN,2023-07-14,166,13,1,Short
52.0,LULA E O SEU GOVERNO,2023-07-14,588,69,2,Short
593.0,"FILHOTE DE BOLSONARO, BOLSONARINHO É! | BIGORNA DA REALIDADE - #03 #BR",2023-07-14,1746,291,18,Short
3471.0,O QUE HÁ POR TRÁS DOS SUBSÍDIOS EUROPEUS? | ÍNDIA NA CORRIDA ESPACIAL - TRAMONTA NEWS - #05 #TN,2023-07-14,3184,376,14,Short
2431.0,MINISTRO DO STF REBATE VAIAS COM FALA POLÊMICA E PL PEDE IMPEACHMENT - TRENDING TOPICS - #42 #TT,2023-07-14,887,73,4,Short
5569.0,ENTENDA A GREVE DOS ATORES | INDICADOS AO EMMY - KINO - #07 #KN,2023-07-14,15417,1689,58,Live
42.0,CICLONE NO SUL DO PAÍS,2023-07-14,616,30,0,Short
3750.0,GOVERNADOR DE SP QUER CRIAR O PRÓPRIO PROGRAMA DE ESCOLAS CÍVICO-MILITARES - FLOW NEWS - #48 #FN,2023-07-13,2645,298,15,Live
55.0,BOLSONARO E SEU ELEITORADO,2023-07-13,274,23,1,Short
297.0,GOL DE GABIGOL É ANULADO E CAUSA REVOLTA #TT,2023-07-13,109,10,0,Short
359.0,FLÁVIO DINO É OVACIONADO EM UNIVERSIDADE #TT,2023-07-13,113,12,0,Short
236.0,CICLONE CAUSA VENTOS FORTES EM SÃO PAULO #TT,2023-07-13,77,8,0,Short
58.0,PASTOR ANDRÉ VALADÃO,2023-07-13,7848,165,30,Short
56.0,O TWITTER VAI ACABAR?,2023-07-13,1101,41,2,Short
263.0,RUMORES DE LUTA ENTRE ZUCKERBERG E MUSK AUMENTAM #FN,2023-07-13,173,9,0,Short
307.0,O MOTIVO DA CRIAÇÃO DE ESCOLAS CÍVICO MILITARES #FN,2023-07-13,167,10,2,Short
259.0,A FORÇA POLÍTICA DE BOLSONARO #FN,2023-07-13,554,16,2,Short
518.0,BOLSONARO PRESTA DEPOIMENTO SOBRE POSSÍVEL GOLPE DE ESTADO #FN,2023-07-13,476,48,5,Short
5703.0,"RAFAEL E LÍDIA DIEDRICH: VOLTA AO MUNDO - CONEXÕES, COM GLORIA VANIQUE - #06 #CX",2023-07-13,1959,182,8,Live
60.0,O QUE OS ESTRANGEIROS ACHAM DO BRASIL,2023-07-13,7494,449,25,Short
3647.0,ZUCKERBERG POSA COM CAMPEÕES DO UFC E AUMENTA RUMORES DE LUTA COM MUSK - FLOW NEWS - #47 #FN,2023-07-13,1354,164,2,Live
48.0,O PROBLEMA DO CENTRO DE SÃO PAULO,2023-07-13,1204,36,1,Short
58.0,O JULGAMENTO DE KEVIN SPACEY,2023-07-13,2648,77,13,Short
2346.0,CRACOLÂNDIA: TUMULTO IMPRESSIONANTE COM DEPREDAÇÃO NO CENTRO DE SP - TRENDING TOPICS - #41 #TT,2023-07-13,1019,127,7,Short
219.0,A IMPORTÂNCIA DO ESPORTE PARA A EDUCAÇÃO DE JOVENS #PA,2023-07-13,90,4,0,Short
655.0,AS ESTRATÉGIAS USADAS POR THIAGO EM UMA COMPETIÇÃO #PA,2023-07-13,51,1,0,Short
372.0,THIAGO PEREIRA FALA SOBRE A PARTICIPAÇÃO DE ATLETAS PARALÍMPICOS NAS OLIMPÍADAS TRADICIONAIS #PA,2023-07-13,49,2,1,Short
191.0,PORQUE NA NATAÇÃO SE DEMORA PARA BATER RECORDES #PA,2023-07-13,65,3,0,Short
52.0,MADELEINE COMENTA CASO ACONTECIDO COM MONARK,2023-07-13,3112,121,6,Short
171.0,COMO THIAGO PEREIRA SE TORNOU O MAIOR MEDALHISTA DE TODOS OS TEMPOS EM JOGOS PAN AMERICANOS #PA,2023-07-13,64,7,0,Short
37.0,LULA E A DEMOCRACIA,2023-07-13,1146,59,2,Short
141.0,PREPARADOR FÍSICO É PRESO APÓS ATOS R@CISTA$ EM JOGO DO CORINTHIANS #TT,2023-07-13,93,7,0,Short
347.0,REJEIÇÃO AO GOVERNO LULA DESPENCA #TT,2023-07-13,108,17,0,Short
465.0,DEPENDENTES QUÍMICO FAZEM ATAQUES NO CENTRO DE SÃO PAULO #TT,2023-07-12,156,15,1,Short
291.0,O FUTURO DA RELAÇÃO  ENTRE TARCÍSIO E BOLSONARO #FN,2023-07-12,432,49,4,Short
248.0,OS CRIMES ATRIBUÍDOS A MAURO CID #FN,2023-07-12,130,14,1,Short
379.0,O NOME RESPONSÁVEL PELA REFORMA TRIBUTÁRIA #FN,2023-07-12,333,23,0,Short
495.0,AS MEDIDAS TOMADAS PELO O BANCO CENTRAL #FN,2023-07-12,209,27,2,Short
413.0,A RESPONSABILIDADE DO EXÉRCITO NOS ATOS DE MAURO CID #FN,2023-07-12,170,15,1,Short
172.0,FILME DA BARBIE É PROIBIDO NO VIETNÃ #TT,2023-07-12,187,9,1,Short
299.0,EX BBB PRIOR É CONDENADO POR E$TUPR0 #TT,2023-07-12,136,9,0,Short
395.0,TIAGO LEIFERT CRÍTICA TORCEDORA QUE MORR*U VÍTIMA DE GARRAFADA #TT,2023-07-12,364,23,11,Short
4273.0,"THIAGO PEREIRA - PORTAS ABERTAS, COM CARLOS TRAMONTINA - #08 #PA",2023-07-12,1060,135,8,Live
4255.0,MAURO CID VAI À CPI FARDADO E DECIDE FICAR EM SILÊNCIO - FLOW NEWS - #46 #FN,2023-07-11,4608,522,22,Live
500.0,AS INJUSTIÇAS POR TRÁS DE UM CANCELAMENTO #FB,2023-07-11,350,29,1,Short
166.0,O APOIO DE BOLSONARO AO LULA E CIRO GOMES #FB,2023-07-11,277,13,0,Short
443.0,OS INTERESSES POLÍTICOS POR TRÁS DE UM CANCELAMENTO #FB,2023-07-11,342,32,1,Short
245.0,O CANCELAMENTO VIROU UM MERCADO? #FB,2023-07-11,237,18,0,Short
299.0,COMO FUNCIONA O MANUAL DO CANCELAMENTO #FB,2023-07-11,138,9,0,Short
1920.0,A POLÊMICA FALA DE TIAGO LEIFERT SOBRE TORCEDORA ATINGIDA POR GARRAFA - TRENDING TOPICS - #40 #TT,2023-07-11,1839,199,16,Short
3814.0,TORCEDORA PERDE A VIDA APÓS SER ATINGIDA POR GARRAFA - FLOW NEWS - #45 #FN,2023-07-11,1611,170,3,Live
335.0,O QUE ESPERAR DO DEPOIMENTO DE MAURO CID #FN,2023-07-11,172,12,0,Short
2210.0,TORCEDORA PALMEIRENSE É NOVA VÍTIMA DE VIOLÊNCIA NO FUTEBOL - TRENDING TOPICS - #39 #TT,2023-07-11,1055,132,4,Short
515.0,SÉRGIO MORO PODE TER MANDATO CASSADO POR USO INDEVIDO DE PODER ECONÔMICO #FN,2023-07-11,526,27,3,Short
626.0,REPUBLICANOS PODERÃO ENTRAR NO GOVERNO #FN,2023-07-11,103,5,1,Short
498.0,REFORMA TRIBUTÁRIA RACHA A DIREITA #FN,2023-07-11,622,39,5,Short
239.0,CONSTRANGIMENTO AO TIRAR DÚVIDA DE AMIGO ESTRANGEIRO SOBRE O BRASIL #FN,2023-07-11,212,14,0,Short
4604.0,MADELEINE LACSKO - FORA DA BOLHA - #06 #FB,2023-07-11,21868,2320,129,Live
814.0,O QUE MUDOU APÓS 6 MESES DOS ATOS GOLPISTAS #FN,2023-07-10,153,12,1,Short
260.0,EDUARDO BOLSONARO COMPARA PROFESSORES COM TRAFICANTES #TT,2023-07-10,58,5,1,Short
177.0,PREFEITA FAZ ENSAIO FOTOGRÁFICO EM ALAGAMENTO #TT,2023-07-10,154,11,1,Short
73.0,SUÁREZ  DEIXA PARTIDA MANCANDO E COM DORES #TT,2023-07-10,43,2,0,Short
209.0,CLASSIFICAÇÃO BRASILEIRÃO RODADA #14 #TT,2023-07-10,100,10,1,Short
253.0,MORRE TORCEDORA ATINGIDA POR GARRAFA DE BRIGA DE TORCIDA #TT,2023-07-10,148,12,0,Short
832.0,AS CONSEQUÊNCIAS APÓS A P@NDEMI* DA C0VID #FN,2023-07-08,750,55,5,Short
354.0,SENADO PROPÕE PROJETO PARA ACABAR COM PENSÕES DE FILHOS DE MILITARES #FN,2023-07-08,315,23,1,Short
695.0,QUEM GANHA E QUEM PERDE COM A APROVAÇÃO DA REFORMA #FN,2023-07-08,548,46,0,Short
552.0,FAKE NEWS DA SEMANA: VÍDEO SUGERE QUE JOE BIDEN SEJA UM ROBÔ #TN,2023-07-08,2549,42,5,Short
985.0,PROPAGANDA USA INTELIGÊNCIA ARTIFICIAL PARA RECRIAR ELIS REGINA E GERA POLÊMICA #TN,2023-07-08,444,26,12,Short
536.0,"MORRE ZÉ CELSO, QUE ESTAVA INTERNADO APÓS SOFRER QUEIMADURAS #TN",2023-07-08,598,24,1,Short
543.0,TEMPERATURA GLOBAL BATEU SEGUNDO RECORDE NESTA SEMANA #TN,2023-07-08,168,16,1,Short
605.0,PASTOR ANDRÉ VALADÃO SERÁ INVESTIGADO PELO MPF APÓS DISCURSO HOMOFÓBICO,2023-07-08,835,48,14,Short
2645.0,"VIÚVA DE GAL COSTA: DENÚNCIAS DA ""PIAUÍ"" | TRETA BOLSONARO x TARCÍSIO - TRENDING TOPICS - #38 #TT",2023-07-08,1430,140,3,Short
289.0,VÍDEO REGISTRA DESABAMENTO DE PRÉDIO NO GRANDE RECIFE #TT,2023-07-08,111,7,0,Short
616.0,TARCÍSIO E BOLSONARO DISCUTEM EM REUNIÃO DO PL #TT,2023-07-08,1888,58,16,Short
566.0,ZÉ CELSO É VELADO COM MULTIDÃO DE FÃS NO TEATRO OFICINA #TT,2023-07-08,491,13,0,Short
536.0,REFORMA TRIBUTÁRIA É APROVADA POR DEPUTADOS #TT,2023-07-08,205,29,4,Short
3399.0,REFORMA TRIBUTÁRIA É APROVADA NA CÂMARA DOS DEPUTADOS - FLOW NEWS - #44 #FN,2023-07-07,3957,429,8,Short
644.0,VALADÃO: DA PREGAÇÃO À PRISÃO?! - BIGORNA DA REALIDADE - #02 #BR,2023-07-07,2812,467,32,Short
3669.0,DEEPFAKE: PROPAGANDA RECRIA ELIS REGINA E GERA DEBATES - TRAMONTA NEWS - #04 #TN,2023-07-07,2208,244,15,Live
1385.0,META LANÇA NOVA REDE SOCIAL PARA COMPETIR COM TWITTER #FN,2023-07-07,777,50,7,Short
760.0,BOLSONARO E TARCÍSIO SE DESENTENDEM EM ENCONTRO DO PL #FN,2023-07-07,2855,246,20,Short
581.0,DEPUTADOS DIZEM QUE REFORMA TRIBUTÁRIA É MÉRITO DO CONGRESSO #FN,2023-07-07,194,16,1,Short
477.0,O QUE FEZ BAPTISTA VIR PARA O BRASIL #CX,2023-07-07,360,33,1,Short
759.0,COMO ERA A VIDA E A FAMÍLIA DE BAPTISTA EM ANGOLA #CX,2023-07-07,284,23,1,Short
226.0,QUAL A VISÃO QUE UM ANGOLANO TEM DO BRASIL #CX,2023-07-07,189,11,0,Short
342.0,BAPTISTA FALA SOBRE O DIA A DIA E A SEGURANÇA EM ANGOLA #CX,2023-07-07,158,12,0,Short
3121.0,THREADS: A NOVA REDE SOCIAL DO INSTAGRAM QUE DEVE RIVALIZAR COM TWITTER - TRENDING TOPICS - #37 #TT,2023-07-07,1000,126,3,Short
211.0,A GUERRA CIVIL QUE DUROU QUASE 30 ANOS EM ANGOLA #CX,2023-07-07,260,32,1,Short
6209.0,O FINAL HORRÍVEL DE THE IDOL | REUNION DE CASAMENTO ÀS CEGAS E MAIS! - KINO - #06 #KN,2023-07-07,11047,1117,44,Live
185.0,COMO FOI PARA BAPTISTA SAIR DE ANGOLA E VIVER DE INTERNET NO BRASIL #CX,2023-07-07,157,14,1,Short
3639.0,BOLSONARO E TARCÍSIO SE DESENTENDEM SOBRE REFORMA TRIBUTÁRIA EM ENCONTRO DO PL - FLOW NEWS - #43 #FN,2023-07-06,3507,437,13,Live
328.0,CANTORA LUDMILLA TROCA INGRESSOS POR DOAÇÃO DE SANGUE #TT,2023-07-06,160,10,0,Short
943.0,INSTAGRAM LANÇA NOVA REDE SOCIAL QUE PROMETE RIVALIZAR COM TWITTER #TT,2023-07-06,205,13,0,Short
362.0,PF FAZ OPERAÇÃO CONTRA SUPOSTOS FINANCIADORES DOS ATAQUES AO AEROPORTO DE BRASÍLIA #TT,2023-07-06,74,3,0,Short
440.0,MORADORES REGISTRAM TIROTEIOS NO COMPLEXO DA PENHA DURANTE OPERAÇÃO POLICIAL #TT,2023-07-06,140,6,0,Short
808.0,LULA DIZ QUE NÍSIA TRINDADE CONTINUA NO MINISTÉRIO DA SAÚDE ATÉ QUANDO ELE QUISER #FN,2023-07-06,977,26,4,Short
684.0,RÚSSIA E UCRÂNIA SE ACUSAM DE QUERER ATACAR USINA NUCLEAR NA EUROPA #FN,2023-07-06,128,11,0,Short
851.0,REFORMA TRIBUTÁRIA PODE SER VOTADA NA CÂMARA NESTA SEMANA #FN,2023-07-06,1179,39,2,Short
638.0,CÚPULA DO MERCOSUL ACABA COM URUGUAI FORA DO TEXTO FINAL E CRÍTICAS DE LULA À UNIÃO EUROPEIA #FN,2023-07-06,348,12,6,Short
5520.0,"BAPTISTA MIRANDA: DA ANGOLA AO BRASIL - CONEXÕES, COM GLORIA VANIQUE - #05 #CX",2023-07-06,6836,836,42,Live
3234.0,SERÁ QUE SAI? REFORMA TRIBUTÁRIA PODE SER VOTADA NA CÂMARA NESTA SEMANA - FLOW NEWS - #42 #FN,2023-07-06,2759,291,19,Short
3020.0,TÉCNICO DA SELEÇÃO: DINIZ E ANCELOTTI? | LUAN NO MOTEL: IMAGENS E RELATO - TRENDING TOPICS - #36 #TT,2023-07-06,773,125,5,Short
439.0,A PERGUNTA QUE NÃO PODERIA SER  FEITA PARA FERNANDO HENRIQUE CARDOSO #PA,2023-07-06,641,46,2,Short
485.0,O INÍCIO DA CARREIRA DE BORIS CASOY #PA,2023-07-06,126,10,0,Short
175.0,COMO AS MÍDIAS TRADICIONAIS ESTÃO SE ADAPTANDO A INTERNET #PA,2023-07-06,96,6,0,Short
317.0,BORIS CASOY FALA SOBRE A RADICALIZAÇÃO NAS REDES SOCIAIS #PA,2023-07-06,240,10,0,Short
285.0,BORIS CASOY FALA SOBRE SUA ATUAL RELAÇÃO COM O JORNALISMO #PA,2023-07-06,501,15,1,Short
475.0,"SOB CRÍTICAS DO URUGUAI À DITADURA DA VENEZUELA, LULA ASSUME PRESIDÊNCIA DO MERCOSUL #TT",2023-07-05,64,7,0,Short
523.0,"CRIADOR DE GRUPO NO DISCORD ACUSADO DE CRIMES CONTRA CRIANÇAS, FAZ CHACOTA ENQUANTO É PRESO #TT",2023-07-05,305,15,3,Short
555.0,IMAGENS DA AGRESSÃO DE LUAN EM MOTEL VIRALIZAM #TT,2023-07-05,133,16,0,Short
907.0,FERNANDO DINIZ É O NOVO TÉCNICO DA SELEÇÃO BRASILEIRA #TT,2023-07-05,86,14,0,Short
301.0,BOLSONARO TEME O SURGIMENTO DE NOVAS LIDERANÇAS DA DIREITA? #FB,2023-07-05,664,29,2,Short
970.0,O MOTIVO QUE TORNOU BOLSONARO INELEGÍVEL ATÉ 2030 #FB,2023-07-05,306,32,2,Short
492.0,SOBRE O VETO DA VENDA DE BLINDADOS PARA A UCRÂNIA #FB,2023-07-05,142,10,5,Short
780.0,OS CRITÉRIOS QUE DETERMINAM UMA DEMOCRACIA #FB,2023-07-05,114,9,1,Short
668.0,O QUE LULA PODE FAZER QUE BOLSONARO NÃO PODIA #FB,2023-07-05,1446,48,9,Short
2531.0,PASTOR ANDRÉ VALADÃO INSINUA QUE FIÉIS DEVEM MATAR PESSOAS LGBTQIA+ - TRENDING TOPICS - #35 #TT,2023-07-05,1336,152,11,Short
609.0,PROPAGANDA FAZ USO DE INTELIGÊNCIA ARTIFICIAL E REVIVE ELIS REGINA #FN,2023-07-05,3091,155,31,Short
488.0,PASTOR ANDRÉ VALADÃO É ACUSADO DE HOMOFOBIA #FN,2023-07-05,732,49,15,Short
393.0,GALÍPOLO É ESCOLHIDO PARA O CARGO DE DIRETOR DE POLÍTICA MONETÁRIA DO BC #FN,2023-07-05,125,10,4,Short
1129.0,LULA DEFENDE RESPOSTA ‘RÁPIDA E CONTUNDENTE’ PARA ACORDO COM UNIÃO EUROPEIA #FN,2023-07-05,621,27,5,Short
663.0,GOVERNADORES E PARLAMENTARES SE REÚNEM PARA DISCUTIR A REFORMA TRIBUTÁRIA #FN,2023-07-05,162,16,2,Short
5086.0,"BORIS CASOY - PORTAS ABERTAS, COM CARLOS TRAMONTINA - #07 #PA",2023-07-05,9826,1112,46,Live
3748.0,LULA DEFENDE RESPOSTA ‘RÁPIDA E CONTUNDENTE’ PARA ACORDO COM UNIÃO EUROPEIA - FLOW NEWS - #41 #FN,2023-07-04,2818,316,10,Live
351.0,TORCEDORES INVADEM MOTEL E AGRIDEM LUAN DO CORINTHIANS #TT,2023-07-04,210,14,1,Short
382.0,CARLOS ALBERTO DE NÓBREGA CRITICA LULA NÃO TER DIPLOMA #TT,2023-07-04,725,36,14,Short
